headline,lead_paragraph,date
Running Rings Around the E.U.,"LONDON — China’s performance at the recent G-20 summit meeting once again showed its skill at running diplomatic rings around Europe. Its audacious eve-of-summit call for a new global reserve currency to replace the dollar, the plaudits it won for a modest contribution to the International Monetary Fund, and President Hu Jintao’s occupancy of the center-stage in the leaders’ photo-call — added up to a great public relations triumph.",2009-04-21 05:00:00+00:00
Running Rings Around the E.U.,"LONDON — China’s performance at the recent G-20 summit meeting once again showed its skill at running diplomatic rings around Europe. Its audacious eve-of-summit call for a new global reserve currency to replace the dollar, the plaudits it won for a modest contribution to the International Monetary Fund, and President Hu Jintao’s occupancy of the center-stage in the leaders’ photo-call — added up to a great public relations triumph.",2009-04-21 11:36:02+00:00
Privatization of Hong Kong Phone Group Rejected,"HONG KONG — A Hong Kong appeals court blocked a plan Wednesday to privatize the city’s biggest phone company, PCCW, dealing a stunning setback to the company’s chairman, Richard Li, and handing a major victory to the city’s increasingly assertive regulatory authorities.",2009-04-22 10:59:37+00:00
PCCW Chairman Drops Bid to Privatize Group,"HONG KONG  Richard Li, the chairman of the city’s biggest phone company, abandoned his bid to privatize it on Thursday, a day after a Hong Kong blocked the plan.",2009-04-23 03:22:17+00:00
U.S. Trade Chief Says Obama Will Push Ahead on Pacts,"WASHINGTON  In his first policy speech, the top United States trade official said Thursday that President Obama would work to revive global trade talks and complete three bilateral accords as part of an aggressive trade agenda. ",2009-04-23 18:27:33+00:00
North Korea Decides to Indict 2 U.S. Reporters,"SEOUL, South Korea  North Korea said Friday that it had decided to indict two American journalists who have been detained for more than five weeks on charges of illegally entering the country and committing “hostile acts.”",2009-04-24 11:50:48+00:00
Iran’s Power Struggle," Just when relations between the United States and Iran seemed to be turning for the better as a result of President Obama’s recent overture to Iran, a new impediment emerged. Roxana Saberi, a 31-year old Iranian-American freelance journalist was arrested in Tehran, put on trial behind closed doors and convicted of espionage for the U.S.",2009-04-28 05:00:00+00:00
Iran’s Power Struggle," Just when relations between the United States and Iran seemed to be turning for the better as a result of President Obama’s recent overture to Iran, a new impediment emerged. Roxana Saberi, a 31-year old Iranian-American freelance journalist was arrested in Tehran, put on trial behind closed doors and convicted of espionage for the U.S.",2009-04-28 11:50:11+00:00
North Korea Calls U.S. Policy ‘Unchanged’ Under Obama,"SEOUL, South Korea — One day after an American diplomat offered new talks on North Korea’s nuclear program, the North said Friday that it had become useless to talk with the United States, adding that “unchanged” American hostility has caused the country to resume and bolster its nuclear efforts.",2009-05-08 06:45:11+00:00
Reopening Channels of Communication With Cuba,To the Editor:,2009-05-09 03:39:03+00:00
Taiwan’s Health and Safety,"H.D.S. Greenway is almost correct in giving the world’s health authorities a high grade for their response to swine flu (“Crises without borders,” Views, May 6), and his analogies to terror and economic crises similarly are almost on target. But there is a loophole.",2009-05-11 05:00:00+00:00
Taiwan’s Health and Safety,"H.D.S. Greenway is almost correct in giving the world’s health authorities a high grade for their response to swine flu (“Crises without borders,” Views, May 6), and his analogies to terror and economic crises similarly are almost on target. But there is a loophole.",2009-05-11 12:10:11+00:00
The Middle Kingdom Meets the Middle East,"BEIJING — With no fanfare, a $5 billion refinery in which Saudi Aramco has a 25 percent stake quietly began processing oil a couple of weeks ago in eastern China. ",2009-05-11 12:55:46+00:00
Workers Pressure Bank to Keep Clothier’s U.S. Plants Open,"DES PLAINES, Ill.  Hartmarx, known for its Hart Schaffner & Marx and Hickey Freeman suits, and for making President Obama’s inauguration tuxedo and topcoat, has long been America’s leading clothier for men. Now its workers want to make the company, which is in bankruptcy, a leader in a different way. ",2009-05-12 01:24:33+00:00
The China Puzzle," On Timothy Geithner’s first day as a Dartmouth freshman, while he was walking across campus on his way to register for classes in the fall of 1979, he heard a man speaking Thai — swearing in Thai, to be precise — from a balcony. Geithner found this amusing, because only a couple of months before, he left his home in Thailand, where his father worked for the Ford Foundation, to move to Hanover, N.H. So he stopped to talk to the man, who turned out to be David Keenan, a Chinese teacher at Dartmouth. The two quickly realized that they had a lot in common; among other things they attended the same schools, about a decade apart, in Bangkok and Delhi. (The cause of Keenan’s swearing, alas, has been lost to history.) Having established a rapport, Keenan then decided to do a little salesmanship. He urged Geithner to take Chinese, the only Asian language that Dartmouth offered at the time.",2009-05-13 19:33:53+00:00
North Korea to Try U.S. Journalists,"SEOUL  Two American journalists who have been detained in North Korea for two months on charges of illegal entry and “hostile acts” will be put on trial June 4, the Communist North announced on Thursday.",2009-05-14 03:25:22+00:00
World Watches for U.S. Shift on Mideast,"WASHINGTON  Five weeks ago, President Obama stood before the Turkish legislature in Ankara and said many Americans had Muslims in their families or had lived in a Muslim-majority country. “I know,” he said, “because I am one of them.”",2009-05-16 17:26:37+00:00
Utah Governor Chosen as Ambassador to China,"WASHINGTON  President Obama on Saturday selected one of the nation’s leading Republican governors to serve as the ambassador to China, nominating Jon Huntsman Jr. of Utah for a diplomatic post that Mr. Obama called “as important as any in the world.” ",2009-05-16 18:29:31+00:00
Lawmakers Question Shutdown of Guantánamo,"Two leading Republican lawmakers on Sunday questioned whether President Obama will be able to meet his January deadline for closing the Guantánamo Bay detention center, and an influential Democrat expressed doubts of his own.",2009-05-17 19:24:31+00:00
The Miracles of Realism,"HO CHI MINH CITY, VIETNAM — There’s an exchange in “The Quiet American,” Graham Greene’s novel about the damage American good intentions can cause, that I’ve thought about a lot. It involves Thomas Fowler, the world-weary journalist-narrator of the book, confronting Alden Pyle, an American aid worker with a blinding zeal to stop Communism.",2009-05-20 05:00:00+00:00
The Miracles of Realism,"HO CHI MINH CITY, VIETNAM — There’s an exchange in “The Quiet American,” Graham Greene’s novel about the damage American good intentions can cause, that I’ve thought about a lot. It involves Thomas Fowler, the world-weary journalist-narrator of the book, confronting Alden Pyle, an American aid worker with a blinding zeal to stop Communism.",2009-05-20 11:23:46+00:00
China Grows More Picky About Debt,"HONG KONG  Leaders in both Washington and Beijing have been fretting openly about the mutual dependence  some would say codependence  created by China’s vast holdings of United States bonds. But beyond the talk, the relationship is already changing with surprising speed.",2009-05-20 22:33:32+00:00
"To Iran, One Step at a Time",BERLIN — American and Iranian leaders have signaled that they’re prepared to talk. That’s good. But getting results may prove to be more difficult than they imagine. ,2009-05-21 05:00:00+00:00
"To Iran, One Step at a Time",BERLIN — American and Iranian leaders have signaled that they’re prepared to talk. That’s good. But getting results may prove to be more difficult than they imagine. ,2009-05-21 13:20:24+00:00
A ‘Reset’ Is Not Enough,The Obama administration has offered to “reset” relations with Russia. But what is really needed is a change of operating system.,2009-05-22 05:00:00+00:00
A ‘Reset’ Is Not Enough,The Obama administration has offered to “reset” relations with Russia. But what is really needed is a change of operating system.,2009-05-22 11:42:46+00:00
North Korea Claims to Conduct 2nd Nuclear Test,"SEOUL, South Korea  North Korea announced on Monday that it had successfully conducted its second nuclear test, defying international warnings and dramatically raising the stakes in a global effort to get the recalcitrant Communist state to give up its nuclear weapons program.",2009-05-25 03:33:06+00:00
"Tested Early by North Korea, Obama Has Few Options","Facing the first direct challenge to his administration by an emerging nuclear weapons state, President Obama declared Monday that the United States and its allies would “stand up” to North Korea, hours after that country defied international sanctions and conducted what appeared to be its second nuclear test.",2009-05-25 06:48:19+00:00
North Korea Misfires,"TOKYO — Lifting economic sanctions, full integration with the West, peace on the Korean peninsula — all are up for discussion if North Korea simply rejoins the Six Party Talks. And yet, in another provocative move, Pyongyang has test-fired more missiles and declared a second nuclear test a success, rattling not only the ground in China but the international nonproliferation community as well. ",2009-05-27 05:00:00+00:00
North Korea Threatens Military Strikes on South,"SEOUL, South Korea  The South Korean and American militaries on Thursday raised their level of alert on North Korea, a day after the Communist North threatened a military clash.",2009-05-27 06:38:14+00:00
North Korea Misfires,"TOKYO — Lifting economic sanctions, full integration with the West, peace on the Korean peninsula — all are up for discussion if North Korea simply rejoins the Six Party Talks. And yet, in another provocative move, Pyongyang has test-fired more missiles and declared a second nuclear test a success, rattling not only the ground in China but the international nonproliferation community as well. ",2009-05-27 12:20:21+00:00
Obama in Netanyahu’s Web,"NEW YORK — Benjamin Netanyahu, the Israeli prime minister, won the first round over President Barack Obama. That’s not good for American interests or for Israel’s long-term security.",2009-05-27 12:31:22+00:00
"In China, Pelosi Calls for Cooperation on Climate","BEIJING  Nancy Pelosi, the House speaker, met China’s two top leaders on Wednesday to discuss cooperation on energy and environmental problems, and Prime Minister Wen Jiabao said Beijing would join Washington to “push for positive results” at the next global warming summit meeting this fall in Copenhagen.",2009-05-27 18:00:35+00:00
South Korea and U.S. Raise Alert Level,"SEOUL, South Korea  One day after North Korea warned of a possible attack against the South, the United States and South Korea ordered their forces here to their highest alert for three years, increasing surveillance flights and satellite reconnaissance to counter what officials termed a “grave threat.”",2009-05-28 03:31:31+00:00
Without Fear or Favor,"Philip Gourevitch (“The Abu Ghraib we cannot see,” Views, May 27) sides with the Obama administration and contends that the U.S. government should not release more photographs that show U.S. personnel handling prisoners at Abu Ghraib and elsewhere. We don’t need any more proof of what happened, Gourevitch says, because more proof won’t help rectify the situation or provide evidence of a chain of command. But who is he to decide that? Who is anyone to decide that? ",2009-05-28 05:00:00+00:00
Help Us or We Leave,"WASHINGTON — Just weeks after the attacks of Sept. 11, I met with an architect of America’s post-9/11 response in the Pentagon. The topic was the impending U.S. invasion of Afghanistan. I asked why he expected America to succeed when every foreign invader in history had failed. ",2009-05-28 11:06:44+00:00
Without Fear or Favor,"Philip Gourevitch (“The Abu Ghraib we cannot see,” Views, May 27) sides with the Obama administration and contends that the U.S. government should not release more photographs that show U.S. personnel handling prisoners at Abu Ghraib and elsewhere. We don’t need any more proof of what happened, Gourevitch says, because more proof won’t help rectify the situation or provide evidence of a chain of command. But who is he to decide that? Who is anyone to decide that? ",2009-05-28 11:06:44+00:00
U.S. Presses China for Tough Response to North Korea,"WASHINGTON  The United States is pressing China to consider taking a variety of severe sanctions against North Korea, including the inspection of suspect ships and planes, as it tries to ratchet up the global response to Pyongyang’s latest nuclear test, administration officials said Thursday.",2009-05-29 02:38:08+00:00
Gates Reassures Allies Over North Korea,"SINGAPORE  Defense Secretary Robert M. Gates said Friday that the United States had detected no unusual military movement in North Korea and had no plans to reinforce some 28,000 American forces in South Korea after the North threatened its neighbor with a military attack.",2009-05-29 09:58:57+00:00
"For U.S. Trade Chief, Patience Is Key","WASHINGTON — Ron Kirk, the unlikely new U.S. trade representative, often jokes about not having a deep background in the arcane world he is wading into, a place of impenetrable jargon and negotiations that seem to drag on for decades.",2009-05-29 13:00:28+00:00
Trade Diplomat Taps His Deal-Making Past,"WASHINGTON  Ron Kirk, the unlikely new United States trade representative, often jokes about not having a deep background in the arcane world he is wading into, a place of impenetrable jargon and negotiations that seem to drag on for decades.",2009-05-29 23:59:34+00:00
Gates Issues Warning to North Korea,"SINGAPORE  Defense Secretary Robert M. Gates warned North Korea on Saturday that the United States would not accept it as a nuclear weapons state, as Asian security officials struggled to find a new way to deal with the isolated Communist nation. ",2009-05-30 19:43:36+00:00
"In China, Geithner Backs Cooperation","BEIJING — Timothy F. Geithner, the U.S. Treasury secretary, said Monday that the global financial crisis seemed to be easing, but that the United States and China would have to work together to stabilize and rebalance the world economy.",2009-06-01 06:30:02+00:00
"G.M.’s New Owners, U.S. and Labor, Adjust to Roles","For decades, the United Automobile Workers had a simple strategy for getting what it wanted from the carmakers  it would go on strike. The tactic proved so successful that the mere threat of a walkout often won better wages, benefits and job security.",2009-06-02 01:13:28+00:00
Crying Wolf,"HANOI — The world resounded with ritual condemnations of North Korea’s nuclear and missile tests, but perceptions of them differ. ",2009-06-02 05:00:00+00:00
Crying Wolf,"HANOI — The world resounded with ritual condemnations of North Korea’s nuclear and missile tests, but perceptions of them differ. ",2009-06-02 13:05:43+00:00
China’s New Rebels,"Updated, June 3, 6:15 p.m. |  John Kamm, of The Dui Hua Foundation, and Kerry Brown, of Chatham House, offer their views on how the Chinese government’s response to dissent has changed in the past two decades. ",2009-06-03 00:48:19+00:00
North Korea Throws Down the Gauntlet,"The Obama administration has so far dealt publicly with the North Korean challenge in an understated, almost leisurely, manner. ",2009-06-03 05:00:00+00:00
North Korea Throws Down the Gauntlet,"The Obama administration has so far dealt publicly with the North Korean challenge in an understated, almost leisurely, manner. ",2009-06-03 20:06:10+00:00
Investors in Developing Markets See Optimism,"MUMBAI, India  If investors in New York and London are seeing the first delicate signs of a recovery, their counterparts in developing countries say they are witnessing a full-on spring. ",2009-06-03 22:06:46+00:00
Don’t Make It Worse,News of the nuclear test in North Korea on May 25 came while I was visiting the demilitarized zone on the Korean Peninsula. I had been invited to the inauguration ceremony for a peace bell on the 38th parallel — the truce line where the hostilities between North and South Korea ceased in 1953.,2009-06-04 05:00:00+00:00
Investors in Developing Markets Optimistic,"If investors in New York and London are seeing the first delicate signs of a recovery, their counterparts in developing countries say they are witnessing a full-on spring.",2009-06-04 11:30:47+00:00
Investors in Developing Markets Optimistic,"If investors in New York and London are seeing the first delicate signs of a recovery, their counterparts in developing countries say they are witnessing a full-on spring.",2009-06-04 11:30:47+00:00
Don’t Make It Worse,News of the nuclear test in North Korea on May 25 came while I was visiting the demilitarized zone on the Korean Peninsula. I had been invited to the inauguration ceremony for a peace bell on the 38th parallel — the truce line where the hostilities between North and South Korea ceased in 1953.,2009-06-04 11:39:36+00:00
2 U.S. Journalists on Trial in N. Korea,SEOUL  Two American journalists were scheduled to go on trial on Thursday in a case that is widely seen as a test of how far the isolated Communist state was willing to take its confrontational stance toward the United States. ,2009-06-04 13:42:22+00:00
‘Red Orchestra’,Greta Goes to Amerika 1927-1929 ,2009-06-05 23:03:46+00:00
China and U.S. Seek a Truce on Greenhouse Gases,"WASHINGTON  For months the United States and China, by far the world’s two biggest emitters of greenhouse gases, have been warily circling each other in hopes of breaking a long impasse on global warming policy. ",2009-06-07 18:04:01+00:00
Talk to the Newsroom: Business Editor Larry Ingrassia,"Larry Ingrassia, business editor of The New York Times, answered questions from readers June 8-12, 2009. He previously answered questions in May 2006.",2009-06-08 00:21:18+00:00
U.S. Weighs Intercepting North Korean Shipments,"WASHINGTON  The Obama administration signaled Sunday that it was seeking a way to interdict, possibly with China’s help, North Korean sea and air shipments suspected of carrying weapons or nuclear technology. ",2009-06-08 01:48:19+00:00
U.S. Protests N. Korea’s Treatment of Journalists,WASHINGTON  President Obama and his top national security aides on Monday urged North Korea to release “on humanitarian grounds” two American journalists sentenced to 12 years of hard labor for entering North Korean territory. But administration officials said that the harsh sentences were likely to be used as a negotiating ploy by the North as it tries to avoid new sanctions in response to its nuclear test two weeks ago. ,2009-06-08 07:19:35+00:00
Seoul Imposes Sanctions on N. Korea,"SEOUL, South Korea  South Korea imposed its first financial sanctions on North Korean companies, officials said Tuesday, taking a symbolic action that could anger the Communist regime while bolstering a joint front with the United States as the allies seek to punish the North for its recent nuclear test.",2009-06-09 09:23:23+00:00
Finding a Way to Take Guantánamo Detainees,"BERLIN — Well away from the limelight, European Union ambassadors met Wednesday in Brussels for sensitive discussions over how to help President Barack Obama close the Guantánamo Bay detention center by agreeing to accept inmates whom the U.S. authorities have cleared for release.",2009-06-10 05:00:00+00:00
Finding a Way to Take Guantánamo Detainees,"BERLIN — Well away from the limelight, European Union ambassadors met Wednesday in Brussels for sensitive discussions over how to help President Barack Obama close the Guantánamo Bay detention center by agreeing to accept inmates whom the U.S. authorities have cleared for release.",2009-06-10 12:22:36+00:00
The Early Word: The Shape of Health Care Bills,"Health care legislation is beginning to take shape in the House and the Senate, with various lawmakers floating ideas and compromises for a public insurance plan and reconsidering possibly taxing employer-provided health benefits.",2009-06-10 12:48:16+00:00
China Protests Moving of Detainees,"BEIJING  The Chinese government protested Thursday over the decision by the American government to resettle a group of Chinese Muslims to the isolated archipelago of Palau. The Uighur men, former detainees at Guantánamo Bay, have been in a state of limbo since they were cleared of wrongdoing last fall.",2009-06-11 14:45:32+00:00
The Early Word: Car Dealers Press Congress,"The heads of General Motors and Chrysler will find themselves on the hot seat again this Friday morning as they testify about the closing of dealerships and their companies' restructuring. The hearing, before the oversight committee of the House Energy Committee, convenes at 10 a.m.",2009-06-12 12:43:22+00:00
The Early Word: Car Dealers Press Congress," The heads of General Motors and Chrysler will find themselves on the hot seat again this Friday morning as they testify about the closing of dealerships and their companies’ restructuring. The hearing, before the oversight committee of the House Energy Committee, convenes at 10 a.m.",2009-06-12 12:43:22+00:00
Privacy May Be a Victim in Cyberdefense Plan,"WASHINGTON  A plan to create a new Pentagon cybercommand is raising significant privacy and diplomatic concerns, as the Obama administration moves ahead on efforts to protect the nation from cyberattack and to prepare for possible offensive operations against adversaries’ computer networks. ",2009-06-13 01:21:33+00:00
Biden Questions Vote but Sticks to Policy on Iran,"WASHINGTON  Vice President Joseph R. Biden Jr. cast doubt Sunday on the legitimacy of the re-election of President Mahmoud Ahmadinejad of Iran, but reaffirmed the administration’s intent to try to engage the Iranian government. ",2009-06-14 17:15:35+00:00
When Giants Meet,"MOSCOW — Chinese President Hu Jintao’s official visit to Russia heralds the significant strides the neighboring giants have made in bilateral relations since the collapse of the Soviet Union. Yet my discussions here over the past week with a range of Russian government officials, businessmen and academics reveal a complex relationship. All in all, as a leading Russian sinologist observed, “China is now becoming a headache for Russia.” ",2009-06-15 05:00:00+00:00
When Giants Meet,"MOSCOW — Chinese President Hu Jintao’s official visit to Russia heralds the significant strides the neighboring giants have made in bilateral relations since the collapse of the Soviet Union. Yet my discussions here over the past week with a range of Russian government officials, businessmen and academics reveal a complex relationship. All in all, as a leading Russian sinologist observed, “China is now becoming a headache for Russia.” ",2009-06-15 12:01:46+00:00
"U.S. to Confront, Not Board, North Korean Ships","WASHINGTON  The Obama administration will order the Navy to hail and request permission to inspect North Korean ships at sea suspected of carrying arms or nuclear technology, but will not board them by force, senior administration officials said Monday.",2009-06-16 02:01:14+00:00
"U.S. to Confront, Not Board, North Korean Ships","WASHINGTON  The Obama administration will order the Navy to hail and request permission to inspect North Korean ships at sea suspected of carrying arms or nuclear technology, but will not board them by force, senior administration officials said Monday.",2009-06-16 09:20:37+00:00
China Tests the Waters,"HONG KONG — China is testing its influence in every direction, trying to balance its need to be seen as a fair global player with its nationalist instincts, to balance a genuine internationalism against the paranoia that comes naturally to a closed political system. ",2009-06-16 13:39:38+00:00
Text: News Conference with Obama and Lee,"Following is a text of the news conference held by President Obama and President Lee Myung-bak of South Korea on Tuesday, as released by the White House.",2009-06-16 17:43:31+00:00
"Weekend Opinionator: Watching Iran, Re-Fighting Iraq","There have been any number of aspects of the Iranian election and ensuing demonstrations that have been worth debating: Should President Obama condemn the regime or would ""meddling"" be counterproductive? Is Twitter the the magic wand of liberty,  is its utility overrated, or is it even working against the dissidents? Is it true that the opposition leader, Mir-Hussein Moussavi, isn't much different from President Mahmoud Ahmadinejad, or has he morphed from a hack politician into a beacon of freedom? Are we even certain there was fraud? ",2009-06-20 02:39:47+00:00
