headline,lead_paragraph,date
Missionary Jailed in North Korea Asks U.S. to Help Free Him,"SEOUL, South Korea — A Korean-American missionary who has been jailed in North Korea for more than a year appeared at a news conference in Pyongyang on Monday and appealed to the United States government to negotiate with Pyongyang to secure his release.",2014-01-20 14:36:49+00:00
Japan Defends Dolphin Hunt After Criticism From U.S. Ambassador,"HONG KONG — The Japanese government Monday defended the practice of dolphin hunting off its coastline, taking issue with the new American ambassador, Caroline Kennedy, who pointedly criticized its “inhumaneness” in a recent Twitter post.",2014-01-21 04:33:37+00:00
Bristling Interrupts Amity in Panel on U.S.-China-Europe Ties,"DAVOS, Switzerland — When asked whether China, the United States and Europe can all play nicely together, attendees of the World Economic Forum would be expected to be largely optimistic, even if they disagreed on a few particulars.",2014-01-23 19:23:20+00:00
JPMorgan’s Chief Gets a Pay Raise,"JPMORGAN’S DIMON TO GET RAISE  |  Despite the legal troubles that JPMorgan Chases faced in 2013, which amounted to more than $20 billion in fines, Jamie Dimon, the bank’s chairman and chief executive, is getting a raise, Jessica Silver-Greenberg and Susanne Craig write in DealBook. The pay increase follows the board’s move last year to cut Mr. Dimon’s compensation in half, to $11.5 million as reprimand for allowing a multibillion-dollar trading mistake known as the London Whale.",2014-01-24 12:27:09+00:00
Weekend Reading: Looking Back at Our View From the Alps,"As the World Economic Forum concludes in Davos, Switzerland, we’re looking back at some of our past coverage of the elite gathering.",2014-01-24 21:09:30+00:00
Tension Grows Between Japan and China,"Relations between China and Japan have been strained since World War II. But now, the regional clash is having a global economic effect, Andrew Ross Sorkin writes in the DealBook column. The battle was on full display last week at the World Economic Forum in Davos, Switzerland, setting off fears that the souring relationship could pose direct economic risk to businesses across the globe. And there may be no one to defuse the situation.",2014-01-28 13:44:49+00:00
"U.S. Says Russia Tested Missile, Despite Treaty","WASHINGTON — The United States informed its NATO allies this month that Russia had tested a new ground-launched cruise missile, raising concerns about Moscow’s compliance with a landmark arms control accord. ",2014-01-30 01:56:25+00:00
Why the U.S. Embassy Releases Pollution Data in Beijing But Not in Delhi,"NEW DELHI — The United States government measures air quality levels in both its Beijing and Delhi embassies, but it only publicizes the results from its Beijing monitor. Why?",2014-01-30 12:13:32+00:00
Russia Claims U.S. Is Meddling Over Ukraine,"KIEV, Ukraine — The tense Russian-American jockeying over the fate of Ukraine escalated on Thursday as a Kremlin official accused Washington of “crudely interfering” in the former Soviet republic, while the Obama administration blamed Moscow for spreading an intercepted private conversation between two American diplomats.",2014-02-06 18:45:42+00:00
U.S. Points to Russia as Diplomats’ Private Call Is Posted on Web,"WASHINGTON — After months of taking grief for snooping on foreign leaders, the Obama administration found itself on the other side on Thursday after a private telephone call between two American diplomats appeared on the Internet in a breach that the White House tied to Russia.",2014-02-06 20:02:05+00:00
U.S. Issues Penalties Over Violations of Iran Sanctions,"The Obama administration penalized nearly three dozen companies and individuals in eight countries on Thursday, accusing them of evading Iranian sanctions. It was the administration’s most extensive enforcement action to target Iran since a temporary international agreement on that country’s disputed nuclear program was completed in November and put into effect last month.",2014-02-07 01:13:46+00:00
U.S. Issues Penalties Over Violations of Iran Sanctions,"The Obama administration penalized nearly three dozen companies and individuals in eight countries on Thursday, accusing them of evading Iranian sanctions. It was the administration’s most extensive enforcement action to target Iran since a temporary international agreement on that country’s disputed nuclear program was completed in November and put into effect last month.",2014-02-07 12:58:29+00:00
Russia and China Skip Security Council Meeting on Humanitarian Aid to Syria,"UNITED NATIONS — The morning after an aid convoy came under fire when it tried to reach a besieged Syrian city, a meeting here on a draft resolution that would force all parties in the bloody conflict to allow access for humanitarian organizations fell apart when representatives from Russia and China failed to show up, United Nations Security Council diplomats said.",2014-02-10 23:37:24+00:00
U.S. Businessman Accused of Being Crime Boss Stands Trial in China,"BEIJING — An American businessman who is accused of loan-sharking, arson, kidnapping rivals and paying thugs to toss acid in the face of a judge, among other crimes, went on trial this week in a case that has raised questions about the use of forced confessions by Chinese courts and that has prompted concern from United States officials.",2014-02-12 13:33:43+00:00
"U.S. and Canada Feel Putin Charm, Hockey Excluded","SOCHI, Russia — Turning on the charm as the host of the Winter Olympics, President Vladimir V. Putin dropped by the headquarters of the American and Canadian teams on Friday evening. He sipped red wine with leaders of the United States Olympic Committee, posed for photographs with stunned athletes and jokingly wished Canada luck — except on the ice in hockey. ",2014-02-15 01:25:47+00:00
South China Sea Tensions a Backdrop to Kerry’s China Visit," North Korea and bilateral relations between the United States and China are dominating Secretary of State John Kerry’s visit to East Asia this week, but tensions continue to simmer in the South China Sea as well.",2014-02-15 03:29:52+00:00
Nuclear Talks With Iran Start Slowly,"VIENNA — The effort to negotiate a comprehensive solution to the Iranian nuclear issue began in earnest on Tuesday, with Iranian negotiators meeting one on one with officials of the United States and other major world powers.",2014-02-18 11:22:19+00:00
U.S. Imposes Visa Ban on 20 Ukrainian Officials as Further Sanctions Are Threatened,"BRUSSELS — Expressing alarm at the lethal escalation of political violence in Ukraine, the European Union and the United States scrambled for a quick response Wednesday, threatening punitive sanctions against senior figures in the Ukrainian government. The Obama administration later said it had placed 20 top Ukrainian officials on a visa blacklist.",2014-02-19 13:26:45+00:00
Nationalistic Remarks From Japan Lead to Warnings of Chill With U.S.,"TOKYO — A series of defiantly nationalistic comments, including remarks critical of the United States, by close political associates of Prime Minister Shinzo Abe has led analysts to warn of a growing chill between his right-wing government and the Obama administration, which views Japan as a linchpin of its strategic pivot to Asia.",2014-02-20 02:11:46+00:00
Women’s Figure Skating Live Updates,,2014-02-20 12:55:59+00:00
China Criticizes Obama Over Visit by Dalai Lama,"WASHINGTON — President Obama welcomed the Dalai Lama to the White House on Friday morning, provoking a sharp rebuke from the Chinese government, which warned that the meeting would severely damage relations between Washington and Beijing.",2014-02-21 18:39:39+00:00
"Amid Fence-Mending, Another U.S.-Russia Rift","WASHINGTON — After putting the tense Russian-American relationship on “pause” last year, President Obama and his team have lately been working to get it back on track by quietly planning a possible meeting this summer with President Vladimir V. Putin. The two sides have even begun discussing a trade agreement for the two to sign.",2014-02-22 03:50:47+00:00
U.S. Army Seeks Better Ties With China’s Military,BEIJING — A top American military commander said Saturday that the United States Army was working to start a formal dialogue and exchange program with the Chinese People’s Liberation Army before the end of the year.,2014-02-22 06:14:17+00:00
"Huntington’s Conflicts, Fukuyama’s World","My Sunday column, on Russian grand strategy and Ukrainian turmoil, doubles as the latest installment in my semi-recurring series dedicated to the idea that ours is still essentially a Francis Fukuyaman world — that is, a world in which the West’s combination of liberal cosmopolitanism and democratic capitalism has no ideological rivals worthy of the name. To elaborate a little on that theme and its significance, let me quote from a Walter Russell Mead essay that ran in the Journal late last week, under the Fukuyama-invoking headline “Putin Knows History Hasn’t Ended”:",2014-02-24 18:28:56+00:00
Departing U.S. Envoy to China Praises Growing Economic Ties,"BEIJING — Gary F. Locke, the departing United States ambassador to China, praised the growing economic ties between the two nations in a final news conference on Thursday but said China needed to make progress in establishing the rule of law and government transparency, and in respecting freedom of expression and human rights.",2014-02-27 10:48:35+00:00
"A Parting Shot at U.S. Ambassador, Inspired by Mao","The departing United States ambassador, Gary F. Locke, gave a farewell news conference in Beijing on Thursday, at which he praised the deepening economic ties between the world’s two biggest economies and urged China and Japan to cool down escalating tensions over a territorial dispute.",2014-02-28 05:50:41+00:00
Mr. Abe's Dangerous Revisionism,"Prime Minister Shinzo Abe’s brand of nationalism is a becoming an ever more serious threat to Japan’s relations with the United States. His use of revisionist history is a dangerous provocation for the region, which is already struggling with China’s aggressive stance in territorial disputes in the East and South China Seas.",2014-03-03 00:09:08+00:00
Putin's Crimean Crime,For Vladimir Putin the break-up of the Soviet Union was the “greatest geopolitical catastrophe” of the 20th century. Everyone has something that makes them tick. Putin’s obsession is the restoration of Russia’s pride through the restoration of its imperium.,2014-03-03 11:49:27+00:00
A Miami Congressman Adamantly Defends Isolating Cuba,"As more Cuban-Americans find ways to engage with Cuba — through travel, helping families with new businesses, and now business training — they have increasingly come into conflict with Cuban-American lawmakers who insist that isolation, through the United States trade embargo, is the best and only acceptable approach when dealing with Cuba.",2014-03-04 21:43:29+00:00
"Debate Over Who, in U.S., Is to Blame for Ukraine","WASHINGTON — In Moscow, especially in the not-so-good old days, the question almost always asked is kto vinovat: “Who is to blame?” The American capital now finds itself engaged in that very Russian exercise ever since President Vladimir V. Putin’s troops entered Ukraine.",2014-03-06 03:34:41+00:00
"Trying to Revive His Prospects, Rubio Pushes Strength Abroad","OXON HILL, Md. — Alarmed by the rise of noninterventionist voices in his party, Senator Marco Rubio, Republican of Florida, is aiming to revive his political prospects in an unlikely way: trying to become the leading voice for a muscular brand of foreign policy.",2014-03-07 02:52:58+00:00
"It’s Unclearly Defined, but Telecommuting Is Fast on the Rise","WE all know what telecommuting is and who does it. It’s working from home (or maybe a Starbucks), and it’s usually done by someone in their 20s, or a mother with small children.",2014-03-07 19:55:11+00:00
House Republicans Balk at Wording in Obama Emergency Aid Package for Ukraine,"WASHINGTON — An emergency aid package for the beleaguered Ukrainian government has become entangled in a partisan dispute over the International Monetary Fund, with House Republicans resisting President Obama’s personal pleas to extend the reach of a Ukraine rescue plan by including long-sought changes to the fund’s structure.",2014-03-10 03:10:37+00:00
Daunting Tests Await Admiral Named N.S.A. Chief,WASHINGTON — It is not hard to understand why veterans of the National Security Agency argue that 2013 was the worst year since Harry S. Truman got the place running 62 years ago. ,2014-03-11 02:17:18+00:00
Russia’s Intervention in Crimea,"Regarding “Crimea, the tinderbox” (Opinion, March 3): Charles King offers great insights into the situation in Crimea and Ukraine and its importance to Russia. But what is problematic is the statement that “affirmations about territorial integrity and cries of foreign invasion are empty mantras.” Territorial integrity is a foundation of international law; without it, there is no “normalcy” to a nation-state.",2014-03-11 10:28:41+00:00
Foes of America in Russia Crave Rupture in Ties,"MOSCOW — As Russia and the United States drift toward a rupture over Crimea, the Stalinist writer Aleksandr A. Prokhanov feels that his moment has finally arrived.",2014-03-15 15:58:51+00:00
"As U.S. Looks for Terror Links in Plane Case, Malaysia Rejects Extensive Help","WASHINGTON — With malicious intent strongly suspected in the disappearance of Malaysia Airlines Flight 370, American intelligence and law enforcement agencies renewed their search over the weekend for any evidence that the plane’s diversion was part of a terrorist plot. But they have found nothing so far, senior officials said, and their efforts have been limited by the Malaysian authorities’ refusal to accept large-scale American assistance.",2014-03-17 01:20:22+00:00
Global Crises Put Obama’s Strategy of Caution to the Test,"WASHINGTON — For five years, President Obama has consciously recast how America engages with the world’s toughest customers. But with Russia poised to annex Crimea after Sunday’s referendum, with a mounting threat to the rest of Ukraine and with the carnage in Syria accelerating, Mr. Obama’s strategy is now under greater stress than at any time in his presidency. ",2014-03-17 02:13:30+00:00
The Ukraine Crisis and U.S. Policy, ,2014-03-17 22:05:31+00:00
New U.S. Ambassador to China Gets a Fast Start,"The new American ambassador to China, Max Baucus, got off to a fast start on his first day on the job in Beijing. Early Tuesday, he visited the Ministry of Foreign Affairs to present a copy of his credentials, a formality that allowed him to meet with journalists at the United States Embassy in the afternoon. ",2014-03-18 11:22:18+00:00
"With Russia, as With China, Unnerved U.S. Allies Seek Reassurances","VILNIUS, Lithuania — Vice President Joseph R. Biden Jr. found himself in a fraught but familiar place this week: holding the hands of American allies fearful of being bullied by a larger, aggressive neighbor.",2014-03-19 16:30:25+00:00
"Even With Ping-Pong, a Formal Meeting in China","BEIJING — Michelle Obama, on the first day of a good-will tour to China with her daughters and her mother, tried her hand on Friday at three quintessentially Chinese specialties: calligraphy, table tennis and mathematics.",2014-03-21 10:28:08+00:00
White House watching Russian troops,U.S. National Security adviser Susan Rice says the U.S. is reconsidering its relationship with Russia based on recent actions by President Vladimir Putin in Ukraine. Rough Cut (no reporter narration),2014-03-21 20:32:09+00:00
Russia Without Illusions,"SINCE the end of the Cold War, America’s policy toward Russia has been shaped by two dangerous illusions.",2014-03-22 18:30:02+00:00
U.S. Emerges as Central Stage in Asian Rivalry,"SEOUL, South Korea — The political and historical war of words between Japan and South Korea has found another battleground: the United States.",2014-03-23 02:23:56+00:00
Japan to Let U.S. Assume Control of Nuclear Cache,"THE HAGUE — Japan will announce Monday that it will turn over to Washington more than 700 pounds of weapons-grade plutonium and a large quantity of highly enriched uranium, a decades-old research stockpile that is large enough to build dozens of nuclear weapons, according to American and Japanese officials.",2014-03-24 01:23:34+00:00
Japan Lets U.S. Assume Control of a Nuclear Cache,"THE HAGUE — Japan announced on Monday that it would turn over to Washington a large cache of weapons-grade plutonium and highly enriched uranium, a decades-old research stockpile that is large enough to build dozens of nuclear weapons, according to American and Japanese officials.",2014-03-24 12:17:43+00:00
Obama Juggles Itinerary in Bid to Ease Tensions Between Two Asian Allies,"WASHINGTON — When President Obama brings together the estranged leaders of Japan and South Korea for a peacemaking session in The Hague on Tuesday evening, it will be the culmination of three months of intense behind-the-scenes American diplomacy. ",2014-03-25 01:03:30+00:00
"On Visit to China, Michelle Obama Eases In Some Political Messages","CHENGDU, China — Michelle Obama’s weeklong trip to China seemed to start as a spring break holiday with her mother and daughters but has turned out to include far more substance — and politics — than the cheerful advocate of fitness and healthful eating she often displays at home.",2014-03-26 00:32:53+00:00
Europe Begins to Rethink Cuts to Military Spending,"LONDON — President Obama spent Wednesday in Brussels talking up the importance of the security relationship between Europe and the United States, but it is considered unlikely that Russia’s seizure of Crimea will prompt increased European military spending at a time of economic anemia and budget cuts.",2014-03-26 20:11:11+00:00
A Tortured Policy Toward Russia,"THE United States has once again twisted itself into a rhetorical pretzel. As when it threatened military action against Syria if a “red line” was crossed, the Obama administration’s rhetoric about Russia and Ukraine goes far beyond what it will be willing and able to enforce. ",2014-03-26 22:40:54+00:00
Your Thursday Briefing,"Welcome to the Morning Briefing on NYT Now, the new app from The New York Times.",2014-03-27 09:51:34+00:00
Potential Crackdown on Russia Risks Also Punishing Western Oil Companies," As the United States seeks to strengthen sanctions on Moscow for its occupation of Crimea, energy experts say the powerful Russian oil industry would make a robust target. But any penalties on energy investments, technology transfers and financial transactions would most likely also punish Western oil companies like Exxon Mobil that are investing heavily in Russia.",2014-03-28 00:13:21+00:00
Citi’s Blues,"TOO BIG TO MANAGE?  |  A day after Citigroup’s capital plan failed the Fed’s stress test for the second time in three years, the bank’s executives were still struggling to understand the Fed’s decision and how best to respond. But the regulator’s rebuke should not have come as a complete surprise, Michael Corkery and Jessica Silver-Greenberg write in DealBook. With the Fed’s decision, a question that has dogged Citigroup for nearly two decades has resurfaced: Is the bank simply too big to manage?",2014-03-28 11:27:44+00:00
Manhattan Real Estate Feels a Russian Chill,"Who doesn’t enjoy a good yarn about Russian oligarchs who throw their fortunes at New York real estate? Take the Russian fertilizer king Dmitry Rybolovlev, who is linked to a record-breaking $88 million sale at 15 Central Park West, or the composer Igor Krutoy, who bought three apartments at the Plaza Hotel. Yet these tales of excess could soon fade into memory. ",2014-03-28 16:47:13+00:00
"Putin Calls Obama to Discuss Ukraine, White House Says","WASHINGTON — President Vladimir V. Putin of Russia reached out to President Obama on Friday to discuss ideas about how to peacefully resolve the international standoff over Ukraine, a surprise move by Moscow to pull back from the brink of an escalated confrontation that has put Europe and much of the world on edge.",2014-03-28 21:14:09+00:00
Climate Study Puts Diplomatic Pressure on Obama,"WASHINGTON — A sweeping new study on the effects of climate change — which the report says is already disrupting the lives and livelihoods of the poorest people across the planet — creates a diplomatic challenge for President Obama, who hopes to make action on both climate change and economic inequality hallmarks of his legacy.",2014-04-01 02:17:23+00:00
"Years After Obama Hailed Warming Ties With India, the Temperature Has Fallen","NEW DELHI — When President Obama visited India in 2010, he called the warming relationship between it and the United States the “defining partnership of the 21st century.” Decades of disagreements, from Cold War ideological battles to squabbles over the United States’ close relationship with India’s archrival, Pakistan, would take a back seat to the many shared interests of two of the world’s largest and most diverse democracies.",2014-04-01 02:52:42+00:00
China: U.S. to Shun Joint Naval Drills," The United States will not send a fleet to take part in naval exercises that China is hosting this month, military officials said Thursday. The decision to shun the Chinese exercises came after American defense officials learned that China did not invite Japan to join the exercises. An American Defense Department official said that the United States was unhappy that Japan had not been invited. Secretary of Defense Chuck Hagel, who is in Hawaii for a meeting of Southeast Asian countries, is headed to Japan and China this weekend for talks with his counterparts in both countries. Military officials said that the issue of the deteriorating relations between the two Asian powers would undoubtedly come up. ",2014-04-04 00:01:23+00:00
U.S. Response to Crimea Worries Japan’s Leaders,"TOKYO — When President Bill Clinton signed a 1994 agreement promising to “respect” the territorial integrity of Ukraine if it gave up its nuclear weapons, there was little thought then of how that obscure diplomatic pact — called the Budapest Memorandum — might affect the long-running defense partnership between the United States and Japan.",2014-04-05 09:20:03+00:00
"In a Test of Wills With China, U.S. Sticks Up for Japan","TOKYO — On his first trip to China as the secretary of defense, Chuck Hagel is finding himself in the middle of a spat that would not be out of place in “Mean Girls,” a movie about social cliques in high school.",2014-04-06 16:20:01+00:00
U.S. Tries Candor to Assure China on Cyberattacks,"WASHINGTON — In the months before Defense Secretary Chuck Hagel’s arrival in Beijing on Monday, the Obama administration quietly held an extraordinary briefing for the Chinese military leadership on a subject officials have rarely discussed in public: the Pentagon’s emerging doctrine for defending against cyberattacks against the United States — and for using its cybertechnology against adversaries, including the Chinese. ",2014-04-07 01:00:45+00:00
"Catholic Schools in U.S. Court China’s Youth, and Their Cash","WAYNE, N.J. — When she arrived at DePaul Catholic High School to join the class of 2014, Di Wang hardly lacked for international experience. The daughter of a Chinese petroleum executive from Shaanxi, she had attended an elite summer camp in Japan. She knew firsthand the pleasures of French cuisine. Her favorite movie was “The Godfather.”",2014-04-07 02:11:24+00:00
Times Minute | Cybersaber Rattling,In the Video,2014-04-07 05:36:47+00:00
Hagel Spars With Chinese Over Islands and Security,BEIJING — The United States and China clashed over Japan on Tuesday as the Chinese defense minister asserted that Beijing had “indisputable sovereignty” over a group of islands in the East China Sea and that his country’s military stood ready to protect its interests in territorial disputes.,2014-04-08 11:48:35+00:00
Battle for the Bigger Screen,"LOS ANGELES — On the surface it’s just an old-fashioned game of Hollywood tit for tat: Cinemark, the nation’s No. 3 theater chain, has been promoting the growth of its network of extra-large movie screens, and Imax, the standard-bearer in the format for decades, has reacted with popped claws.",2014-04-12 01:02:15+00:00
Iran Escalates Dispute Over U.N. Envoy,"UNITED NATIONS — Iran’s increasingly angry protests over the American decision to not grant a visa to its new United Nations ambassador, and the uncertainty over how far the dispute will go, have not only rubbed feelings on both sides raw. They have laid bare the limits of global law when its provisions clash with the interests of the host country, the United States.",2014-04-15 19:22:16+00:00
"Between Obama and Putin, a Game of He Said, He Said","WASHINGTON — President Vladimir V. Putin of Russia telephoned President Obama on Monday afternoon to discuss the escalating crisis in Ukraine. On that, the White House and the Kremlin agree. On just about everything else, the two sides are hopelessly at odds.",2014-04-17 00:59:50+00:00
