headline,lead_paragraph,date
Atomic Agency Is Pressed on Iran Records,"The Obama administration and its European allies are pressing the International Atomic Energy Agency to make public evidence that they believe points toward an Iranian drive to gain the ability to build a nuclear weapon, part of a broad effort to build a case for far more punishing sanctions against the country.",2009-08-26 01:21:25+00:00
U.S. Mulls Alternatives for Missile Shield,"BERLIN  The Obama administration has developed possible alternative plans for a missile defense shield that could drop hotly disputed sites in Poland and the Czech Republic, a move that would please Russia and Germany but sour relations with American allies in Eastern Europe.",2009-08-29 01:39:01+00:00
U.S. Says Pakistan Made Changes to Missiles Sold for Defense,"WASHINGTON  The United States has accused Pakistan of illegally modifying American-made missiles to expand its capability to strike land targets, a potential threat to India, according to senior administration and Congressional officials. ",2009-08-29 19:01:24+00:00
North Korea Opens Border; Again Calls for U.S. Treaty,"SEOUL, South Korea  North Korea restored regular border crossings for traffic going to South Korean factories in the North on Tuesday, while its leader, Kim Jong-il, reiterated his government’s call for a peace treaty with the United States.",2009-09-01 07:37:27+00:00
U.S. Is Seeing Policy Thorns in Japan Shift,"WASHINGTON  Japan’s landmark election presents the Obama administration with an untested government, creating a new set of imponderables for a White House already burdened by foreign policy headaches in Afghanistan, Iran and North Korea.",2009-09-02 01:55:53+00:00
Merkel Signals Support for Tougher Iran Sanctions,"BERLIN — As foreign powers weigh further efforts to rein in Iran’s nuclear program, the German chancellor, Angela Merkel, is sounding markedly more determined about imposing tougher sanctions on the government in Tehran.",2009-09-02 05:00:00+00:00
Merkel Signals Support for Tougher Iran Sanctions,"BERLIN — As foreign powers weigh further efforts to rein in Iran’s nuclear program, the German chancellor, Angela Merkel, is sounding markedly more determined about imposing tougher sanctions on the government in Tehran.",2009-09-02 20:15:44+00:00
New U.S. Ambassador to China Predicts Broad Engagement,"BEIJING  The new United States ambassador to China, Jon M. Huntsman Jr., laid out a vision of close engagement with China on a broad range of issues on Wednesday, including regional stability and the environment, and said that human rights must continue to be a major part of bilateral talks.",2009-09-03 00:00:31+00:00
Japan’s New Leader Reassures U.S. on Alliance,"TOKYO  Scrambling to mend fences with his country’s biggest ally, Japan’s next leader, Yukio Hatoyama, told President Obama and the United States ambassador on Thursday that the American alliance was the basis of Japanese foreign policy.",2009-09-03 09:21:00+00:00
"100, 75, 50 Years Ago", 1909 Americans Ready for Chinese Loan ,2009-09-10 05:00:00+00:00
"100, 75, 50 Years Ago", 1909 Americans Ready for Chinese Loan ,2009-09-10 16:00:54+00:00
"Nations Remain Divided on Global Warming Policy, U.S. Negotiator Says",WASHINGTON  The Obama administration’s senior negotiator on global warming warned Thursday that developed and developing nations remained deeply divided in talks on reducing greenhouse gases and that time was running out before United Nations treaty negotiations in December.,2009-09-10 23:26:20+00:00
U.S. to Accept Iran’s Proposal to Hold Face-to-Face Talks,"WASHINGTON  The Obama administration said Friday that the United States would accept Iran’s offer to meet, fulfilling President Obama’s pledge to hold unconditional talks despite the Iranian government’s insistence that it would not negotiate over the future of its nuclear program.",2009-09-12 01:30:46+00:00
Reading File,Golf Diplomacy: Speak Softly and Carry a 9-Iron,2009-09-12 17:39:04+00:00
China Moves to Retaliate Against U.S. Tire Tariff,"HONG KONG  China unexpectedly increased pressure Sunday on the United States in a widening trade dispute, taking the first steps toward imposing tariffs on American exports of automotive products and chicken meat in retaliation for President Obama’s decision late Friday to levy tariffs on tires from China. ",2009-09-13 16:49:00+00:00
China-U.S. Trade Dispute Has Broad Implications,"HONG KONG — An increasingly acrimonious trade dispute between China and the United States over the past three days is officially about tires, chickens and cars, but is really much broader. ",2009-09-14 11:27:41+00:00
U.S. Sees Opportunities in Angola,"LUANDA, ANGOLA — Donald Steinberg arrived in Angola in 1995 as U.S. ambassador to find American oilmen doing more than drilling for coastal crude.",2009-09-15 11:10:05+00:00
How to Talk to Iran,"GENEVA — The five-page Iranian platform for talks with major powers — “Cooperation for Peace, Justice and Progress” — has been much mocked as evasive blather, but is in fact an instructive document that suggests the endeavor may not be hopeless. It bears close scrutiny.",2009-09-16 05:00:00+00:00
How to Talk to Iran,"GENEVA — The five-page Iranian platform for talks with major powers — “Cooperation for Peace, Justice and Progress” — has been much mocked as evasive blather, but is in fact an instructive document that suggests the endeavor may not be hopeless. It bears close scrutiny.",2009-09-16 12:40:49+00:00
Backsliding on Human Rights,NEW YORK — The European leaders gathering at the United Nations for the General Assembly may feel a little smug. For eight years they struggled to persuade George W. Bush that multilateralism mattered. Now Barack Obama has embraced the U.N. enthusiastically.,2009-09-17 05:00:00+00:00
Backsliding on Human Rights,NEW YORK — The European leaders gathering at the United Nations for the General Assembly may feel a little smug. For eight years they struggled to persuade George W. Bush that multilateralism mattered. Now Barack Obama has embraced the U.N. enthusiastically.,2009-09-17 12:20:49+00:00
The Fallout of a Reversal on Missile Defense,"Updated, Sept. 18, 2:30 p.m. | Paul A. Goble, a longtime analyst of the countries in the former Soviet orbit, assesses Moscow’s response to Mr. Obama’s missile defense strategy. ",2009-09-17 19:57:44+00:00
Russia’s Reaction on Missile Plan Leaves Iran Issue Hanging,"MOSCOW  President Obama’s decision to cancel an antimissile defense system in Eastern Europe earned a strong welcome from Russian leaders on Friday. Now, the question is whether Russia will do more to help prevent Iran from developing nuclear weapons. ",2009-09-18 20:02:52+00:00
U.S. Fears Pakistan Aid Will Feed Graft,"ISLAMABAD, Pakistan  As the United States prepares to triple its aid package to Pakistan  to a proposed $1.5 billion over the next year  Obama administration officials are debating how much of the assistance should go directly to a government that has been widely accused of corruption, American and Pakistani officials say.",2009-09-20 23:43:19+00:00
Russia Tries to Control the Reset Button,"BRUSSELS — When Russia issues a reminder that it wants to buy an advanced, helicopter-carrying warship from France that’s built for amphibious assaults — hello all you folks along the Black, Baltic and Caspian Seas — then it’s pressing deeper its own reset button on altered relations with the United States and NATO.",2009-09-21 05:00:00+00:00
Russia Tries to Control the Reset Button,"BRUSSELS — When Russia issues a reminder that it wants to buy an advanced, helicopter-carrying warship from France that’s built for amphibious assaults — hello all you folks along the Black, Baltic and Caspian Seas — then it’s pressing deeper its own reset button on altered relations with the United States and NATO.",2009-09-21 10:00:48+00:00
A U.S. Envoy Makes a Case for the U.N.,"UNITED NATIONS  The small bus carrying a group of United Nations Security Council ambassadors through the teeming streets of Port-au-Prince, Haiti, this spring was moving at a good clip, with heavily armed guards in police vehicles fore and aft blaring their sirens. ",2009-09-22 01:26:08+00:00
"In China, Philanthropy as a New Measuring Stick","HONG KONG  As the 10th anniversary of his company approached this month, Jack Ma sat down and penned a note to his 15,000 employees at Alibaba Group. The chief executive reflected briefly on the success of his enterprise, which in a decade has become an e-commerce juggernaut with more than 100 million users and has vaulted him into the ranks of China’s ultrarich. But the bulk of his message concerned another theme: philanthropy.",2009-09-23 00:05:44+00:00
Cracks in Iran’s Clique,"For the first time since Iran began enriching uranium that could be used in a nuclear weapon, we have a glimmer of hope for a diplomatic solution to this problem  as long as we are not too diplomatic, as long as the Iranian regime is made to understand that biting economic sanctions are an absolute certainty and military force by Israel is a live possibility.",2009-09-23 03:32:11+00:00
"In China, Philanthropy as a New Measuring Stick","HONG KONG  As the 10th anniversary of his company approached this month, Jack Ma sat down and penned a note to his 15,000 employees at the Alibaba Group. The chief executive reflected briefly on the success of his enterprise, which in a decade has become an e-commerce juggernaut with more than 100 million users and has vaulted him into the ranks of China’s ultra- rich. ",2009-09-24 00:23:35+00:00
Burmese Opposition Supports New U.S. Approach,"BANGKOK  The decision by the United States to engage the ruling junta in Myanmar drew the endorsement Thursday of the nation’s most high-profile dissident, Daw Aung San Suu Kyi, but analysts cautioned that the change would not have a significant effect in the near term.",2009-09-24 11:46:31+00:00
China Opposes Iran Sanctions Sought by U.S.,"BEIJING  China will not support increased sanctions on Iran as a way to curb its nuclear program, a government spokeswoman said Thursday. ",2009-09-24 12:31:39+00:00
U.S. and Allies Warn Iran Over Nuclear ‘Deception’,"PITTSBURGH  President Obama and his allies raced Friday to use their revelation of a secret Iranian nuclear enrichment plant as long-sought leverage against Tehran, demanding that the country allow highly intrusive international inspections and propelling the confrontation with Tehran to a new and volatile pitch.",2009-09-25 08:22:40+00:00
Can Sanctions Work Against Iran?,"Updated, Sept. 28, 9:30 a.m. | Obama administration officials said on Sunday that they were seeking harsher sanctions against Iran, including, possibly, a cutoff of investments to the country’s oil-and-gas industry and restrictions on many more Iranian banks. ",2009-09-25 19:39:49+00:00
The U.S.-Iranian Triangle,NEW YORK — France and Germany fought three wars in 70 years before the bright idea dawned of enfolding their problem into something larger: the European Union. The United States and Iran have not gone to war but have a relationship of psychotic mistrust. The answer can only be the same: Broaden the context.,2009-09-27 05:00:00+00:00
The U.S.-Iranian Triangle,NEW YORK — France and Germany fought three wars in 70 years before the bright idea dawned of enfolding their problem into something larger: the European Union. The United States and Iran have not gone to war but have a relationship of psychotic mistrust. The answer can only be the same: Broaden the context.,2009-09-27 14:00:50+00:00
U.S. Is Seeking a Range of Sanctions Against Iran,"WASHINGTON  The Obama administration is scrambling to assemble a package of harsher economic sanctions against Iran over its nuclear program that could include a cutoff of investments to the country’s oil-and-gas industry and restrictions on many more Iranian banks than those currently blacklisted, senior administration officials said Sunday.",2009-09-27 16:48:46+00:00
Warmer U.S.-Russia Relations May Yield Little in Action Toward Iran,"MOSCOW  The Kremlin has long responded to proposals for tougher sanctions against Iran with arms folded and a scowl. Last week, that attitude began softening, bringing the Obama administration closer to a diplomatic coup in its efforts to contain the Iranian nuclear program.",2009-09-28 01:52:57+00:00
John Burns Q and A: Ending the War in Iraq," This week, John F. Burns, The Times’s chief foreign correspondent, is answering readers’ questions on the end of the American war in Iraq.",2009-09-29 14:52:49+00:00
Back to Her Golden Court in Beijing," Technically, the defending women’s champion at the China Open is Jelena Jankovic, the slumping Serbian who defeated Svetlana Kuznetsova in the final last year when Jankovic’s game and self-belief were in better shape.",2009-09-30 05:00:00+00:00
Eight Ideas Behind China's Success,"BEIJING — Beijing is celebrating the 60th anniversary of the People’s Republic on Thursday, and the fanfare will undoubtedly irk those whose ideological inclinations do not tolerate a “Communist country” being so self-righteous. ",2009-09-30 05:00:00+00:00
Germany's No. 2 Looks to the Spotlight,"BERLIN — There is a great boon to being Germany’s foreign minister. Within a short time, the minister usually becomes one of the country’s most popular politicians.",2009-09-30 05:00:00+00:00
Germany's No. 2 Looks to the Spotlight,"BERLIN — There is a great boon to being Germany’s foreign minister. Within a short time, the minister usually becomes one of the country’s most popular politicians.",2009-09-30 15:20:31+00:00
Eight Ideas Behind China's Success,"BEIJING — Beijing is celebrating the 60th anniversary of the People’s Republic on Thursday, and the fanfare will undoubtedly irk those whose ideological inclinations do not tolerate a “Communist country” being so self-righteous. ",2009-09-30 15:20:52+00:00
Back to Her Golden Court in Beijing," Technically, the defending women’s champion at the China Open is Jelena Jankovic, the slumping Serbian who defeated Svetlana Kuznetsova in the final last year when Jankovic’s game and self-belief were in better shape.",2009-09-30 19:00:52+00:00
Solar Panel Tariff May Further Strain U.S.-China Trade,HONG KONG  Companies that import solar panels to the United States are facing up to $70 million in unexpected tariffs.,2009-09-30 19:53:52+00:00
"As U.S. Plots Iran Strategy, Envoy’s Visit Hints at a Thaw","WASHINGTON  As the United States and Iran prepared for critical talks over Tehran’s nuclear program, the Iranian foreign minister arrived quietly in Washington on Wednesday to visit the unofficial embassy here, the first visit to the capital by an Iranian of that rank in a decade.",2009-10-01 01:30:03+00:00
Iran Again: Is Everyone Bluffing?,"Iran is back in the forefront of public diplomacy. President Obama, jointly with Prime Minister Gordon Brown of Britain and President Nicolas Sarkozy of France, held a press conference in which they seemed to give Iran one more ultimatum: Conform to their demands, what they called the demands of the “international community,” by December of this year or face new sanctions. Mr. Obama said that Iran is “breaking the rule that all nations must follow.”",2009-10-01 13:40:54+00:00
Now Comes the Hard Part,"Europe is in love with Barack Obama, according to recent polls. But will this affair of the heart be a brief flirtation or something more enduring? Like many relationships, the partners themselves may not really know until times get tough. With troubles looming in Afghanistan and Iran, that day of reckoning is fast approaching. ",2009-10-04 05:00:00+00:00
Now Comes the Hard Part,"Europe is in love with Barack Obama, according to recent polls. But will this affair of the heart be a brief flirtation or something more enduring? Like many relationships, the partners themselves may not really know until times get tough. With troubles looming in Afghanistan and Iran, that day of reckoning is fast approaching. ",2009-10-04 13:00:56+00:00
Mending Fences for 2 Asian Leaders,"SEOUL — The North Korean leader, Kim Jong-il, held talks with the visiting prime minister of China, Wen Jiabao, on Sunday as his government tried to mend ties with Beijing, while international attention focused on whether Pyongyang could be coaxed back to the negotiating table over its nuclear weapons program.",2009-10-04 13:32:23+00:00
Black Market Shows Iran Can Adapt to Sanctions,"WASHINGTON  President Obama has vowed to keep the pressure on Iran over its nuclear program after last week’s meeting in Geneva, and his advisers said the United States was intensively recruiting other nations to join in a harsher economic embargo against Tehran should diplomacy fail.",2009-10-04 23:28:33+00:00
Critics Protest Gap in Dalai Lama’s Schedule,"WASHINGTON  When the Dalai Lama landed here on Monday, he set off on a characteristically hectic, weeklong schedule including lectures, seminars, an awards ceremony and meetings with a senior State Department official and the House speaker, Nancy Pelosi.",2009-10-06 01:10:19+00:00
"Near Whistler, a Place to Play for Less","In the last 5,000 years, the Squamish Valley of British Columbia has seen all kinds of people come and go. Long ago there were native bands who lived on salmon and shellfish and gave the region their name, followed in the 19th century by European traders, trappers, farmers, loggers and prospectors, who brought Chinese and Sikh laborers to build dikes and to work sawmills.",2009-10-07 03:00:40+00:00
"Near Whistler, a Place to Play for Less","In the last 5,000 years, the Squamish Valley of British Columbia has seen all kinds of people come and go. Long ago there were native bands who lived on salmon and shellfish and gave the region their name, followed in the 19th century by European traders, trappers, farmers, loggers and prospectors, who brought Chinese and Sikh laborers to build dikes and to work sawmills.",2009-10-07 03:00:40+00:00
Marking 8 Years of the Afghan War,To the Editor:,2009-10-08 03:50:43+00:00
Chinese Premier Calls for Dialogue Between U.S. and North Korea,BEIJING  China’s prime minister called Saturday for the United States and North Korea to engage in a “conscientious and constructive dialogue” aimed at reviving multilateral talks over the North’s nuclear weapons program.,2009-10-10 20:05:41+00:00
The Early Word: The Health Care Vote,"On Tuesday, it becomes five-for-five.",2009-10-13 12:05:23+00:00
The Early Word: The Health Care Vote,"On Tuesday, it becomes five-for-five.",2009-10-13 12:05:23+00:00
Russia Resists U.S. Position on Sanctions for Iran,"MOSCOW  Denting President Obama’s hopes for a powerful ally in his campaign to press Iran on its nuclear program, Russia’s foreign minister said Tuesday that threatening Tehran now with harsh new sanctions would be “counterproductive.”",2009-10-13 15:11:06+00:00
America the Hegemon,Charles Krauthammer has got a cure for what ails America. ,2009-10-14 21:34:56+00:00
America the Hegemon,Charles Krauthammer has got a cure for what ails America. ,2009-10-14 21:34:56+00:00
"With Obama in White House, U.S. Words Have New Weight in Guinea","CONAKRY, Guinea  The Club Obama does not look like much, just a square thatched-roof platform jutting out to the ocean where jembe music, beer and the young mix at the edge of the pungent Boulbinet fish market. ",2009-10-15 01:25:22+00:00
Anxiety in Canada Over Near Parity With U.S. Dollar,"OTTAWA  For Canadians looking to escape winter’s premature arrival in many parts of the country by visiting the United States, the equally unexpected movement of the Canadian dollar toward parity with its American counterpart is welcome news. For corporate Canada, however, the development is less inspiring.",2009-10-15 01:56:32+00:00
"In Face of Sanctions, China Premier Warms to Iran","WASHINGTON  The Obama administration’s effort to marshal global support for new sanctions against Iran hit another snag on Thursday, when China said it was seeking to increase cooperation and high-level exchanges with Iran, suggesting that it would not support additional punitive measures over Tehran’s nuclear program.",2009-10-15 20:22:07+00:00
China Looks to Britain Before U.S. for Deals,"From Julia Werdigier, a DealBook colleague:",2009-10-16 15:29:12+00:00
China Looks to Britain Before U.S. for Deals,"From Julia Werdigier, a DealBook colleague:",2009-10-16 15:29:12+00:00
$70 a Barrel: A New Floor for the Oil Industry?,"NEW YORK — After years of volatility, oil prices have found a level that seems to satisfy producing nations, oil companies and major consumers. ",2009-10-19 05:00:00+00:00
Beijing Goes After U.S.-Made Nylon,BEIJING — Toothbrushes and nylon socks have become the latest projectiles in the continuing trade skirmish between the China and the United States.,2009-10-19 13:16:49+00:00
$70 a Barrel: A New Floor for the Oil Industry?,"NEW YORK — After years of volatility, oil prices have found a level that seems to satisfy producing nations, oil companies and major consumers. ",2009-10-19 14:30:10+00:00
Watching Beijing's Air Power Grow,BEIJING — Welding torches flare at dusk in the coastal Chinese city of Dalian as workers mill about on the flight deck of an unfinished aircraft carrier once intended for the Soviet navy.,2009-10-20 05:00:00+00:00
Watching Beijing's Air Power Grow,BEIJING — Welding torches flare at dusk in the coastal Chinese city of Dalian as workers mill about on the flight deck of an unfinished aircraft carrier once intended for the Soviet navy.,2009-10-20 10:30:16+00:00
The Early Word: Seeking Legitimacy,"With Afghans digesting the news that they must return to the polls in three weeks to decide a presidential election, the Obama administration is caught up in a debate about whether the president can wait that long to decide whether to send thousands more American soldiers to fight insurgents in the region.",2009-10-21 12:16:20+00:00
What's With Iran?,"As a former U.S. national security official, I have been straining — along with many fellow Americans — to understand the Iranian nuclear puzzle. What is really going on with Iran? While it is difficult to know exactly what or whom to believe, we can try to connect the dots of recent news reports and put forth several hypotheses.",2009-10-21 13:00:50+00:00
Where Is U.S. Foreign Policy Headed?,"eoliberalism, which dominated the decade before 9/11, had an exuberantly simple vision. Communism and authoritarianism had failed; therefore markets and free elections were the answer. Free-market democracy, conveniently spread by globalization, would transform the world into a community of productive, peace-loving nations. Instead, the ensuing years saw repeated economic crises outside the West, genocide in Rwanda and the former Yugoslavia, intensifying fundamentalism, virulent anti-Americanism and finally the attacks on the World Trade Center and the Pentagon.",2009-10-22 20:28:53+00:00
South Korea Rising,"HO CHI MINH CITY — Squeezing news from summit meetings of the Association of South East Asian Nations is always difficult, and the meeting that began Oct. 23 in Thailand is unlikely to be an exception. ",2009-10-23 05:00:00+00:00
South Korea Rising,"HO CHI MINH CITY — Squeezing news from summit meetings of the Association of South East Asian Nations is always difficult, and the meeting that began Oct. 23 in Thailand is unlikely to be an exception. ",2009-10-23 12:01:06+00:00
Don’t Build Up,"It is crunch time on Afghanistan, so here’s my vote: We need to be thinking about how to reduce our footprint and our goals there in a responsible way, not dig in deeper. We simply do not have the Afghan partners, the NATO allies, the domestic support, the financial resources or the national interests to justify an enlarged and prolonged nation-building effort in Afghanistan. ",2009-10-28 02:58:33+00:00
The China List,"As the White House prepares for President Obama’s inaugural visit to China in November, it’s faced with two possible approaches in planning for what the trip can achieve. ",2009-10-30 05:00:00+00:00
The China List,"As the White House prepares for President Obama’s inaugural visit to China in November, it’s faced with two possible approaches in planning for what the trip can achieve. ",2009-10-30 13:00:57+00:00
U.S. prepares to broach hard issues with China,"WASHINGTON — The Obama administration plans to realign the United States' relationship with China by putting more emphasis on climate change, energy and human rights, widening the focus beyond the economic concerns of the Bush years, according to senior administration officials.",2009-11-01 05:00:00+00:00
North Korea Presses U.S. to Agree to Bilateral Talks,"SEOUL  North Korea has again pressed the United States for a decision about starting bilateral talks, with a diplomat warning Monday that the North was “ready to go our own way” with its nuclear weapons program.",2009-11-02 04:49:53+00:00
Beijing's 'Marshall Plan',"China’s foreign policy is about to change, and not entirely by choice.",2009-11-03 05:00:00+00:00
Clinton will ask Asian leaders for better effort to solve global problems,"NEW YORK — Secretary of State Hillary Rodham Clinton will take a message demanding a ""more rigorous and persistent engagement"" by Asian leaders in solving global problems when she travels to the region for her first overseas trip next week, Clinton said Friday.",2009-11-03 05:00:00+00:00
Beijing's 'Marshall Plan',"China’s foreign policy is about to change, and not entirely by choice.",2009-11-03 12:41:22+00:00
