headline,lead_paragraph,date
What the Chinese Want From Obama,"(Photo: (Photo: Oliver Weiken/Agence France-Presse — Getty Images) Secretary of State Hillary Clinton met with President Hu Jintao in the Great Hall of People, Beijing.)   As she meets with Chinese leaders this weekend, Secretary of State Hillary Rodham Clinton is expected to begin a more vigorous engagement with China on issues ranging from climate change to the global financial crisis.   We asked these experts, all of whom are based in China, what people there expect from the Obama administration and what issues they think should be on Mrs. Clinton's agenda.      Daniel A. Bell, professor at Tsinghua University Andy Xie, economist Zhang Haibin, professor at Peking University Michael Meyer, author and hutong expert    Chinese Skepticism Daniel A. Bell is professor of political theory at Tsinghua University in Beijing. He is the author of ""China's New Confucianism: Politics and Everyday Life in a Changing Society.""   Hillary Clinton visits China at a time when fewer young people are looking West for political ideals, when American-style capitalism is typically blamed for the global financial crisis, and when foreign firms have lost their shine. This attitude shift means that building a more mature U.S.-China relationship and broaching issues like global warming and human rights will require even deeper engagement.    (Click to enlarge.) ""The Audacity of Hope"" on display in Beijing, where students seem immune to 'Obama mania.' (Photo: Frederic J. Brown/Agence France-Presse — Getty Images)Most of my students seem surprisingly immune to Obama mania. That may be because relations between China and the United States have been steady since the Sept. 11, 2001, terrorist attacks, largely because the Bush administration turned its attention away from China and toward other perceived threats.   Of course, there is respect for Mr. Obama's intellectual abilities and leadership skills. But even ""liberal"" students are given to skepticism. One of my graduate students told me that she was dismayed by the uncritical coverage of the inauguration, the kind of love-fest for a political leader that could only make the leadership of the Chinese Communist Party envious. We discussed, only half-jokingly, the possibility that China should adopt some form of constitutional monarchy, so that the public could project its emotions on a symbolic leader while evaluating the de facto political leader's performance more rationally.   For now, debate over political structures has taken a back seat to worries about the financial meltdown. China's export-based economy has been hit hard, though there's optimism that domestic consumers will lead the recovery. Today, the most competitive jobs are in the public sector, with tens of thousands of students competing for jobs in the civil service that offer more security.  Most students recognize that change must come, but democracy is now more often blamed for political instability and economic inefficiency. Hence, they and many intellectuals are turning to China's own traditions for inspiration. Democracy with Chinese characteristics is still the slogan, with more debates centering on the Chinese characteristics.   The Obama administration could better connect with these groups, which have influence on political change, by showing a genuine interest in China's culture, allowing for the possibility of morally justifiable difference and treating China as an equal with something positive to offer. At this moment, even symbolic gestures -- perhaps using a few words of Chinese in speeches addressing them -- could help in that direction.    Two Economies, Inseparable Andy Xie, formerly of the World Bank, is an economist based in Shanghai.  It's never been more true that Americans and the Chinese are joined at the hip, at least economically. And nothing demonstrates that more clearly than the current financial crisis — which may make the U.S.-China relationship more of a partnership and also more fraught with new kinds of tensions.   What happens in Florida and Arizona can have a significant and immediate effect on jobs in Guangdong. For example, when 70 percent of the furniture sold in the United States is made in China, any downturn in the housing market (fewer buyers of new furniture) means layoffs in China. The United States lost three million jobs since the subprime-mortgage debacle. China has lost 20 million.  Many Chinese are now very uneasy about the country's huge holdings of United States treasuries and agency bonds. More than five million Chinese college students are graduating, and they will compete for jobs against five million college graduates from previous years who haven't found jobs. Ten million unemployed college graduates pose a big stability issue for the Chinese government. That is a situation that can push a country into a more aggressive posture, sometimes toward trading partners. Though, so far, the Chinese leadership has taken more conciliatory stance toward the United States than popular opinion demands.  On the finance side, the United States is now the largest foreign investor in China. And China is the largest owner of the U.S. treasury bonds. Some estimates put China 's holdings of the U.S. debt papers at $1.7 trillion. Since President Obama's $783 billion fiscal stimulus will be financed by issuing more treasuries, there's no doubt China's continued buying of the bonds will be essential.   But many Chinese are becoming very uneasy about the country's huge holdings of United States treasuries and agency bonds. America has gotten into the current trouble from living beyond its means — borrowing to maintain a lifestyle it cannot afford.   The Obama policies don't address this problem. In fact, the stimulus replaces household borrowing with government borrowing, with ever more debt owed to foreigners. China's position as the largest creditor adds to the concern here about the dollar's value and how well the U.S. is managing the financial crisis.   Lastly, the valuation of the yuan could remain a divisive issue for the two nations. In fact, the yuan's value should be allowed to float in the future. But to insist on that now would be dangerous with the dollar's stability dependent on its linkage to yuan. If China is pressured to float the yuan, the dollar's value could fall, causing an inflationary surge in the United States. We need to work out a long-term plan for floating the yuan, but not use megaphone diplomacy to harangue China into doing something that could hurt everyone now.    How to Make Progress on Climate Issues Zhang Haibin is an associate professor at the School of International Studies, Peking University, and a member of the Expert Team on Trade and Environment, Chinese Ministry of Commerce.   It's unrealistic to expect a great leap in climate cooperation between China and the United States, given the complexity of the issue and the lack of mutual trust. Still, there are good signs that meaningful progress can be made with the Obama administration.    (Click to enlarge.) Factory in Tianjin. (Photo: Reuters)As the world's two biggest energy consumers and emitters of greenhouse gases, both nations have to find ways to create low-carbon economies. China is potentially a huge market for clean energy technology, and the United States has advanced energy technology and rich resources. Cooperation on this issue could actually lead to better economic and trade relations.   Three factors, however, have stood in the way, even though the two nations have signed almost 40 bilateral energy and environmental agreements in the last three decades. Until now, there's been reluctance on the part of the United States to make climate change a real priority in bilateral relations with China. (The European Union and Japan both released joint statements with China on climate change, demonstrating their intention to work together.)  The U.S. should set an example on greenhouse gas limits that China can follow. Hostility toward Communism excludes China from receiving official development aid from the United States, which could significantly hasten climate-change-related projects. Such aid remains a main channel for North-South cooperation on climate change, and without it China-U.S. efforts have been crippled. (Japan and the European Union both provide aid to China for climate-change projects.)   Perhaps the greatest hurdle has been the disagreement over which nations should take the lead in curbing greenhouse gas emissions. The United States required developing nations, China and India in particular, to reduce emissions in step with developed countries; China rejected any binding mitigation commitment.   The Obama administration could end this impasse by signing a summit document on climate change with China, helping China invest in climate-change projects by providing development assistance, and setting an example by accepting binding emissions targets.  In response, China will need to show that it can meet the ambitious energy conservation and emissions mitigation targets in its 11th Five-Year Plan. It should set firm targets beyond 2010, and be open to a discussion of when China will join the developed countries in accepting binding targets.  Nobody knows exactly how far and fast the two nations can go in addressing climate change. But it's clear that cooperation on this issue will, to a great extent, define their future relations.    China's American Way of Life  Michael Meyer is the author of ""The Last Days of Old Beijing: Life in the Vanishing Backstreets of a City Transformed.""  If Hillary Clinton were to step away from photo-ops at the Great Hall of the People and walk 200 yards south past the edge of Tiananmen Square, she would enter Dazhalan — a half-square mile of 114 hutong, or lanes. Home to 57,000 people, this 800-year-old neighborhood exemplifies the sort of urban planning that many American cities seek to recreate, featuring narrow, car-free streets enlivened by a tight-knit community. Mrs. Clinton should visit the area while it's still there; wide roads are slated to pierce through the heart of this historical center, where a new boutique mall and a Wal-Mart already shadow its edges.    (Click to enlarge.) One of the Beijing alleyway neighborhoods known as hutong. (Photo: Shiho Fukada for The New York Times)To rationalize their destruction, city officials call these neighborhoods slums. They are not. As blighted as their single-story courtyard homes may be — most lack central heat and toilets — the hutong do not cause pathologies, but instead foster the type of civic life absent in Beijing's high-rise apartments, partitioned by security guards, fences, multilock doors and a lack of public space.   While no one should have to live in poverty, no matter how picturesque, the lanes' melting pot of natives and migrants, laborers and entrepreneurs, old and young, form a safe, diverse community that would be familiar to Mrs. Clinton, author of a text praising the social model of a village. In Beijing, she might note, it takes a hutong to raise a child.   While fewer than one-eighth of the capital's lanes survive, it may seem beyond our top diplomat's authority to lobby for their preservation. Certainly, Mrs. Clinton's Chinese counterpart could counter with some choice observations of Washington. (Prince Charles, who has never visited Beijing, recently launched a project with a Chinese university to modernize the lanes' housing.)   Yet as modernizing Chinese cities emulate America's car-friendly designs — and often employ American architects, but not clean-energy firms to realize it — she could tie China's urbanization into her broader agenda of engaging Beijing in a partnership to reduce emissions and increase energy efficiency, measures that would affect global health and the economy.   ""If Chinese want to live the American way of life, then we need seven earths to support them,"" the founder of China's first environmental nongovernmental organization once told me. That impact is of less concern to a government funding large-scale urbanization in the service of economic growth. Planners and officials here often insist, with rightful indignation, that ""we have every right to make the same development mistakes that America did.""  Mrs. Clinton could correct that perception with a visit to the hutong the way her husband galvanized AIDS awareness when he hugged an H.I.V.-positive girl at a Beijing speech in 2003. Photos of that encounter still circulate, and AIDS prevention is one of the few positive issues that link Sino-American exchanges. Smart growth could be another. By placing the same importance on development as the countries apply to trade and security, China can learn from the United States' planning mistakes, while also showcasing its huge investment in national infrastructure — airport expansions, bridge-building, high-speed rail projects.   When I first arrived in China as a Peace Corps volunteer in 1995, an American diplomat counseled, ""Forget democracy. You're here to create future Pepsi drinkers."" So here's a suggestion in turn: Mrs. Clinton, forgo a tour of Beijing's restored palaces and impressive Olympic venues. Instead, take a short walk down to Dazhalan's narrow lanes, and as the flashbulbs pop, simply say, ""This is the type of neighborhood I wish America had more of."" If she's thirsty, Wal-Mart's wide aisles are crowded with Pepsi.  ",2009-02-20 13:00:34+00:00
What the Chinese Want From Obama,"As she meets with Chinese leaders this weekend, Secretary of State Hillary Rodham Clinton is expected to begin a more vigorous engagement with China on issues ranging from climate change to the global financial crisis. ",2009-02-20 13:00:34+00:00
Clinton Paints China Policy With a Green Hue,"BEIJING  Declaring that “we hope you won’t make the same mistakes we made,” Secretary of State Hillary Rodham Clinton invited China to join the United States in an ambitious effort to curb greenhouse gases, as she toured an energy-efficient power plant in Beijing on Saturday.",2009-02-21 12:22:55+00:00
Clinton urges China to fight climate change,"BEIJING — Declaring that ""we hope you won't make the same mistakes we made,"" Secretary of State Hillary Rodham Clinton invited China to join the United States in an ambitious effort to curb greenhouse gases.",2009-02-22 05:00:00+00:00
An Interview With Ma Ying-jeou,"Following is a transcript of an interview with President Ma Ying-jeou of Taiwan, on Feb. 12, supplied by the Government Information Office of Taiwan. Keith Bradsher, of The New York Times, and Jeanne Moore, of The International Herald Tribune, conducted the interview.",2009-02-22 05:32:56+00:00
Decision by court could delay PCCW bid,HONG KONG — The High Court in Hong Kong on Tuesday gave the city's stock market regulator three weeks to present evidence of alleged manipulation of a vote approving a plan to privatize PCCW - the latest twist in one of Hong Kong's highest-profile corporate dramas.,2009-02-24 05:00:00+00:00
U.S. commerce pick carries lengthy China résumé,SEATTLE — Top slots in the Obama administration were filling up fast when Gary Locke was asked by a friend several weeks ago whether he expected to get a job offer from the new president.,2009-02-25 05:00:00+00:00
China Says U.S. Distorts Facts in Report on Rights,"BEIJING  Chinese authorities reacted caustically on Thursday to an annual State Department report on global human rights that called China’s respect for rights not only “poor,” but also worsening in its persecution of ethnic minorities and dissidents. ",2009-02-26 11:02:07+00:00
"U.S., Pakistan and Afghanistan to Hold Regular Talks","WASHINGTON  Intensifying its focus on Afghanistan and Pakistan, the United States said Thursday that it would hold regular three-way meetings with top officials from the neighboring countries, which the Obama administration sees as the main front of the battle against Islamic extremism.",2009-02-27 01:48:28+00:00
Obama’s Backing Raises Hopes for Climate Pact,"Until recently, the idea that the world’s most powerful nations might come together to tackle global warming seemed an environmentalist’s pipe dream.",2009-03-01 02:12:01+00:00
U.S. and China revive military talks,"BEIJING — Two days of military consultations between the United States and China ended Saturday with glowing reviews from the senior Pentagon official at the talks, who said that high-level meetings between the nations on military issues, suspended last year, would resume soon.",2009-03-01 05:00:00+00:00
"Hard Paths to Treaty, U.S. Law on Climate","[UPDATED, 3/2, below] The lead story in The Times is a significant review of the challenges and opportunities awaiting nations on the road to December climate talks in Copenhagen. Many parties bound by the Kyoto Protocol . Emerging economic powers like China and the old guard, led by the United States, remain deeply divided over who must move first on emissions. President Obama’s options on domestic climate legislation are constrained by economic trouble and divisions among lawmakers related to states’ reliance on fossil fuels.",2009-03-01 16:48:35+00:00
Pursuing the spirit of Niu,"Probably because of the financial crisis, most people have been referring to the Chinese Year of Niu (""bull"" or ""ox"" in Chinese) as the year of the ox. But a bullish period will be emerging sooner from the crisis if we learn something from the spirit of Niu.",2009-03-02 05:00:00+00:00
Scientists Fear Visa Trouble Will Drive Foreign Students Away,"CAMBRIDGE, Mass.  When Alena Shkumatava opens the door to the “fish lab” at the Whitehead Institute of M.I.T., she encounters warm, aquarium-scented air and shelf after shelf of foot-long tanks, each containing one or more zebra fish. She studies the tiny fish in her quest to unravel one of the knottiest problems in biology: how the acting of genes is encouraged or inhibited in cells. ",2009-03-02 21:44:56+00:00
Scientists in U.S. fear visa trouble will drive foreign students away,"CAMBRIDGE, Massachusetts — When Alena Shkumatava opens the door to the ""fish lab"" at the Whitehead Institute of MIT, she encounters warm, aquarium-scented air and shelf after shelf of foot-long tanks, each containing one or more zebra fish. She studies the tiny fish in her quest to unravel one of the knottiest problems in biology: how the acting of genes is encouraged or inhibited in cells.",2009-03-03 05:00:00+00:00
North Korea threatens civilian planes,"SEOUL — North Korea warned Thursday that it might shoot down South Korean commercial airliners flying near its territory during U.S.-South Korean military drills next week, ratcheting up threats against its neighbor.",2009-03-05 05:00:00+00:00
North Korea threatens to shoot down civilian planes,"SEOUL — North Korea warned Thursday it might shoot down South Korean commercial airliners flying near its territory during U.S.-South Korean military drills next week, ratcheting up threats against its neighbor.",2009-03-05 05:00:00+00:00
Seoul warns North Korea to withdraw airline threat,"HONG KONG — South Korea lashed out Friday at an ominous warning from North Korea that appeared to threaten civilian planes traveling though the region. And while hectoring comments are routinely made by the North, often in vivid and inflammatory language, the threat caused enough uncertainty that Singapore Airlines rerouted some of its flights.",2009-03-06 05:00:00+00:00
Seoul warns North Korea to withdraw airline threat,"HONG KONG — South Korea lashed out Friday at a warning from North Korea that appeared to threaten civilian planes traveling though the region. While hectoring comments are routinely made by the North, often in vivid and inflammatory language, the threat caused enough uncertainty that three airlines announced they were rerouting some flights.",2009-03-06 05:00:00+00:00
A Rising Dollar Lifts the U.S. but Adds to the Crisis Abroad,"As the world is seized with anxiety in the face of a spreading financial crisis, the one place having a considerably easier time attracting money is, perversely enough, the same place that started much of the trouble: the United States.",2009-03-09 00:21:11+00:00
Appeal of U.S. debt adds to pain of ailing nations,"WASHINGTON — As the world is seized with anxiety in the face of a spreading financial crisis, the one place having a considerably easier time than others in attracting money is, perversely enough, the same place that started much of the trouble: the United States.",2009-03-09 05:00:00+00:00
Citigroup buoys Wall Street,"NEW YORK — Wall Street soared Tuesday morning after strong showings in Asian and European markets, with the Dow industrials rebounding more than 300 points, as investors got a taste of what they desperately craved: a glimmer of optimism in the financial sector.",2009-03-10 05:00:00+00:00
Global shares soar on hint of hope,"NEW YORK — Stocks soared globally Monday, as the U.S. Federal Reserve chairman called for broad changes in the financial regulatory system and investors got a taste of what they desperately craved: a glimmer of optimism in the financial sector.",2009-03-10 05:00:00+00:00
China and U.S. Clash on Naval Fracas,"WASHINGTON  The confrontation between a United States naval vessel and five Chinese ships is the “most serious” military dispute between the countries since a midair collision in 2001 forced an American surveillance plane to land on Hainan island, the director of national intelligence, Dennis C. Blair, said Tuesday before the Senate Armed Services Committee.",2009-03-10 08:37:09+00:00
The Academic Freedom Agenda," WHEN A MARINE HELICOPTER bore George W. Bush away from the Capitol the afternoon of Jan. 20, the American people turned their attention, and desperate hopes, to his successor. Bush, meanwhile, moved into a new home in Dallas and took up the work of his post-presidency. He had often said that he viewed the Freedom Agenda — his campaign to promote democracy around the world, and above all in the Middle East — as the great legacy of his time in office. And now, even as Obama and his foreign-policy team edge away from the language of democracy promotion, which they fear that the Freedom Agenda has rendered toxic, Bush has begun to shape what he has called the Freedom Institute, a policy center to be housed alongside his presidential library and museum on the campus of Southern Methodist University. The institute is scheduled to begin operating in the fall; the former president and members of the George W. Bush Foundation are now scouting for an executive director. ",2009-03-10 14:33:25+00:00
China Protests a U.S. Resolution on Tibet,BEIJING  China has lodged a formal complaint with the Obama administration over a resolution passed Wednesday by the House of Representatives urging China to “cease its repression of the Tibetan people” and “to respond to the Dalai Lama’s initiatives to find a lasting solution to the Tibetan issue.”,2009-03-12 13:14:20+00:00
Obama Calls for Military Dialogue With China,"WASHINGTON  President Obama told China’s foreign minister on Thursday that their two countries need to raise “the level and frequency” of military dialogue “in order to avoid future incidents” like the high seas confrontation between naval vessels this week, the White House said.",2009-03-12 22:39:08+00:00
Europe’s Hedging on Inmates Clouds Guantánamo Plans," European countries that have offered to help the Obama administration close the detention center at Guantánamo Bay, Cuba, have begun raising questions about the security risks and requirements if they accept prisoners described by the Bush administration as “the worst of the worst,” according to diplomats and other officials.",2009-03-15 20:17:14+00:00
‘Unfriendly Fire’,Brain Drain: Arabic Linguists ,2009-03-18 22:52:00+00:00
North Korea Said to Detain U.S. Reporters,"SEOUL, South Korea  Two American journalists on a reporting trip to the border between China and North Korea have been detained by the North Korean military, a human rights activist and another source said Thursday.",2009-03-19 05:38:27+00:00
Trade Barriers Rise as Slump Tightens Grip,"WASHINGTON  After repeated pledges by world leaders to avoid erecting trade barriers, protectionism is on the march, provoking nasty trade disputes and undermining efforts to plot a coordinated response to the deepest global economic downturn since World War II.",2009-03-23 00:45:44+00:00
Olympic Leaders Lash Out at U.S.O.C. Revenue Deal, Pressure on the United States Olympic Committee to renegotiate its existing revenue-sharing agreement with the International Olympic Committee rose to another level when an angry group of Olympic leaders voted to terminate the contract and renegotiate a new one.,2009-03-25 18:29:44+00:00
"U.S. Sees Chinese Military Rise, and a Need for More Contact","WASHINGTON  China is seeking technology and weapons to disrupt the traditional advantages of American forces, and secrecy surrounding its military creates the potential for miscalculation on both sides, according to a Pentagon study released Wednesday.",2009-03-25 23:05:47+00:00
North Korea Moves Missile to Launch Pad,"SEOUL, South Korea  North Korea has placed a long-range missile on a launch pad before a test that the United States, Japan and South Korea said would violate a United Nations Security Council resolution, a news report said Thursday.",2009-03-26 05:23:12+00:00
U.S. Sees Chinese Military Rise,"WASHINGTON  China is seeking technology and weapons to disrupt the traditional advantages of American forces, and secrecy surrounding its military creates the potential for miscalculation on both sides, according to a Pentagon study released Wednesday.",2009-03-26 09:19:20+00:00
