headline,lead_paragraph,date
"As Workers Fall Ill, U.S. Presses Mexico to Keep American-Owned Plants Open","MEXICO CITY — The Trump administration and major U.S. manufacturers have successfully pressured Mexico to keep factories that supply the United States operating during the coronavirus pandemic, even as outbreaks erupt and waves of cases and deaths sweep the companies.",2020-04-30 20:53:00+00:00
Some Trump Officials Take Harder Actions on China During Pandemic,"WASHINGTON — Some top Trump administration officials are moving to take a more aggressive stand against China on economic, diplomatic and scientific issues at the heart of the relationship between the world’s two superpowers, further fraying ties that have reached their lowest point in decades.",2020-05-01 22:45:35+00:00
Kim Jong-un Is Back. What Happens When He’s Really Gone?,"SEOUL, South Korea — North Korea’s leader, Kim Jong-un, reappeared in dramatic fashion this weekend when he was shown on North Korean media after three weeks of unexplained absence, cutting the ribbon on a fertilizer factory — and quieting rumors that he was gravely ill.",2020-05-02 08:16:16+00:00
Global Backlash Builds Against China Over Coronavirus,BRUSSELS — Australia has called for an inquiry into the origin of the virus. Germany and Britain are hesitating anew about inviting in the Chinese tech giant Huawei. President Trump has blamed China for the contagion and is seeking to punish it. Some governments want to sue Beijing for damages and reparations.,2020-05-03 10:17:19+00:00
"Pompeo Ties Coronavirus to China Lab, Despite Spy Agencies’ Uncertainty","WASHINGTON — Secretary of State Mike Pompeo on Sunday backed President Trump’s assertion that the coronavirus originated in a research laboratory in Wuhan, China, though the nation’s intelligence agencies say they have reached no conclusion on the issue.",2020-05-03 22:24:08+00:00
China Quiets Talk of Coronavirus Cover-Up in Wuhan,,2020-05-04 04:02:06+00:00
World Leaders Join to Pledge $8 Billion for Vaccine as U.S. Goes It Alone,"BRUSSELS — Prime ministers, a king, a prince and Madonna all chipped in to an $8 billion pot to fund a coronavirus vaccine.",2020-05-04 22:26:46+00:00
"Ji Chaozhu, Interpreter for China During Nixon’s Trip, Dies at 90","Ji Chaozhu, who was a longtime interpreter for top Chinese officials, including Mao Zedong and Deng Xiaoping, and who was at Zhou Enlai’s side during President Richard M. Nixon’s groundbreaking trip to China in 1972, died on April 29. He was 90.",2020-05-05 22:26:22+00:00
Trump Says He’s ‘Torn’ on China Deal as Advisers Signal Harmony on Trade,"WASHINGTON — President Trump criticized China for failing to hold up its end of the trade deal on Friday and said he was “very torn” about the fate of the agreement signed in January, even as his closest economic advisers released a statement reassuring the world that the truce was intact.",2020-05-08 10:50:07+00:00
"With Push From Trump, Senate Moves to Install Contentious Filmmaker at U.S. Media Agency","WASHINGTON — Senate Republican leaders, under pressure from President Trump to install an ally who would dictate more favorable news coverage of his administration, are moving to swiftly confirm a conservative filmmaker to lead the independent agency in charge of state-funded media outlets.",2020-05-08 20:12:52+00:00
U.S. Hits Back at China With New Visa Restrictions on Journalists,"The Trump administration is imposing new restrictions on Chinese journalists working in the United States, escalating its conflict with China over the news media as the two countries battle for economic, geopolitical and messaging dominance worldwide.",2020-05-09 11:27:42+00:00
"China Flare-up, Taiwan, Bangkok Pet Salons: Your Monday Briefing",(Want to get this briefing by email? Here’s the sign-up.),2020-05-10 19:21:58+00:00
"U.S. to Accuse China of Trying to Hack Vaccine Data, as Virus Redirects Cyberattacks",WASHINGTON — The F.B.I. and the Department of Homeland Security are preparing to issue a warning that China’s most skilled hackers and spies are working to steal American research in the crash effort to develop vaccines and treatments for the coronavirus. The efforts are part of a surge in cybertheft and attacks by nations seeking advantage in the pandemic.,2020-05-10 23:08:08+00:00
China Is Defensive. The U.S. Is Absent. Can the Rest of the World Fill the Void?,"SYDNEY, Australia — When Australia started pushing for a global inquiry into the origins of the coronavirus pandemic, no other countries were on board, and officials had no idea how it would work or how harshly China might react.",2020-05-11 09:00:38+00:00
The Era of Offshoring U.S. Jobs Is Over,Some say crises don’t so much alter the course of history as accelerate changes already underway. That’s certainly the case when it comes to the coronavirus pandemic and the offshoring of American jobs.,2020-05-11 23:11:26+00:00
Federal Retirement Fund Halts Planned China Investment Under Pressure,"WASHINGTON — A government retirement fund on Wednesday halted plans to invest in Chinese stocks this year, after growing criticism that the move would channel the savings of government workers to companies that are working against the national security goals of the United States.",2020-05-13 21:09:42+00:00
"T.S.M.C. Is Set to Build a U.S. Chip Facility, a Win for Trump","SAN FRANCISCO — Taiwan Semiconductor Manufacturing Company has agreed to build an advanced chip factory in the United States, in a response to the Trump administration’s growing concerns about the security of the global electronics supply chain and its competitive tensions with China.",2020-05-14 22:22:37+00:00
"U.S. and China Trade Coronavirus Accusations, Sparking Fears of a New Cold War","On May 1, a visibly relieved Matt Hancock announced that the British government had exceeded its target of 100,000 coronavirus tests a day. As health secretary, Mr. Hancock had set the goal after enduring intense criticism for the country’s lagging coronavirus testing program.",2020-05-15 04:01:34+00:00
U.S. Delivers Another Blow to Huawei With New Tech Restrictions,"WASHINGTON — The Trump administration issued a new rule Friday that will bar Huawei and its suppliers from using American technology and software, a significant escalation in the White House’s battle with the Chinese telecom giant and one that is likely to inflame tensions with Beijing.",2020-05-15 13:24:45+00:00
From ‘Respect’ to ‘Sick and Twisted’: How Coronavirus Hit U.S.-China Ties,“Evil.” “Lunacy.” “Shameless.” “Sick and twisted.” China has hit back at American criticism over its handling of the coronavirus pandemic with an outpouring of vitriol as acrid as anything seen in decades.,2020-05-15 15:53:49+00:00
U.S.-China Feud Over Coronavirus Erupts at World Health Assembly,A meeting of the World Health Organization that was supposed to chart a path for the world to combat the coronavirus pandemic instead on Monday turned into a showcase for the escalating tensions between China and the United States over the virus.,2020-05-18 23:10:55+00:00
U.S. Is Using Taiwan as a Pressure Point in Tech Fight With China,"The Trump administration has for years sparred with China over tariff threats, technology and the terms of their trade deal. But in a pair of actions last week, the administration escalated those economic tensions in a way that comes close to touching a red line for Beijing: its contentious relationship with Taiwan.",2020-05-19 12:28:10+00:00
Trump Is Playing the China Card. Who Believes Him?,"There is a long history of American presidential candidates using China as a campaign cudgel — from Bill Clinton blasting President George H.W. Bush in 1992 for dealing with a Chinese premier known as the “Butcher of Beijing” to Donald Trump’s 2016 attack that the Obama administration had allowed China to “rape” the United States while Hillary Clinton was secretary of state. This election year, China-bashing will reach a new level, as Mr. Trump seeks to capitalize on high voter disapproval of China, Beijing’s failure to contain the coronavirus and persistent bilateral tensions between our countries.",2020-05-19 23:00:07+00:00
Iran Quietly Lowers the Temperature With U.S.,"BAGHDAD — After years of increasing tensions that nearly led to war, Iran has moderated its approach to the West, shifting from a policy of provocation to one of limited cooperation. The change reflects an effort to avoid direct confrontation with the United States that the Iranians say could benefit President Trump in the November election.",2020-05-19 23:13:32+00:00
W.H.O. Members Reject Trump’s Demands but Agree to Study Its Virus Response,"WASHINGTON — President Trump’s angry demands for punitive action against the World Health Organization were rebuffed on Tuesday by the organization’s other member nations, which decided instead to conduct an “impartial, independent” examination of the W.H.O.’s response to the coronavirus pandemic.",2020-05-19 23:25:38+00:00
China’s Hong Kong Crackdown Could Put Trump in an Unwelcome Spot,"WASHINGTON — China’s plans to impose sweeping new security powers over Hong Kong could inflict even more damage on already fraught relations between Washington and Beijing, and force President Trump into uncomfortable decisions about whether to maintain his self-described friendly ties with the Chinese president, Xi Jinping.",2020-05-21 21:38:55+00:00
Top U.S. Officials Threaten Action on China Over Hong Kong Security Law,"WASHINGTON — Secretary of State Mike Pompeo said on Friday that a broad new security measure proposed by China would amount to a “death knell” for Hong Kong’s political freedoms, as Trump administration officials warned of punishments — possibly including revoking the territory’s special economic and trading status.",2020-05-22 16:08:33+00:00
Why China’s Move to Rein In Hong Kong Is Just the Start,"China’s move to strip away another layer of Hong Kong’s autonomy was not a rash impulse. It was a deliberate act, months in the making. It took into account the risks of international umbrage and reached the reasonable assumption that there would not be a significant geopolitical price to pay.",2020-05-24 12:13:37+00:00
"Hong Kong Has Lost Autonomy, Pompeo Says, Opening Door to U.S. Action","WASHINGTON — Secretary of State Mike Pompeo announced on Wednesday that the State Department no longer considered Hong Kong to have significant autonomy under Chinese rule, a move that indicated the Trump administration was likely to end some or all of the United States government’s special trade and economic relations with the territory in southern China.",2020-05-27 16:30:49+00:00
"House Passes Uighur Human Rights Bill, Prodding Trump to Punish China","WASHINGTON — The House voted overwhelmingly on Wednesday to pass a measure that would punish top Chinese officials for detaining more than one million Muslims in internment camps, sending President Trump a bill intended to force him to take a more aggressive stand on human rights abuses in China.",2020-05-27 21:58:51+00:00
U.S. to Penalize Work at Iranian Facilities in Latest Blow to Nuclear Accord,"WASHINGTON — The State Department announced on Wednesday that it would begin imposing economic penalties on foreign businesses working at Iranian nuclear facilities, the latest effort by the Trump administration to dismantle an Obama-era accord with Tehran.",2020-05-28 00:59:14+00:00
"E.U. Aid, Dominic Cummings, U.S. Coronavirus Deaths: Your Thursday Briefing",(Want to get this briefing by email? Here’s the sign-up.),2020-05-28 04:10:35+00:00
"China Approves Plan to Rein In Hong Kong, Defying Worldwide Outcry",,2020-05-28 07:17:22+00:00
U.S. to Expel Chinese Graduate Students With Ties to China’s Military Schools,"WASHINGTON — The Trump administration plans to cancel the visas of thousands of Chinese graduate students and researchers in the United States who have direct ties to universities affiliated with the People’s Liberation Army, according to American officials with knowledge of the discussions.",2020-05-28 09:00:25+00:00
Will the U.S. Soon Treat Hong Kong Like China? Much Is at Stake,Hong Kong risks becoming collateral damage in the growing rivalry between China and the United States.,2020-05-28 10:23:03+00:00
Pompeo Hits Out at China,"The White House steps up pressure on China, Betsy DeVos redistributes the wealth (to the wealthy, her education opponents argue) and the mask wars intensify. It’s Thursday, and this is your politics tip sheet.",2020-05-28 11:02:48+00:00
"Beijing Hardens Resolve to Defy U.S., Even While Calling for Cooperation","BEIJING —  Ignoring threats from Washington, China stripped another layer of autonomy from Hong Kong on Thursday, plowing ahead with a plan that would ban any form of dissent deemed subversive in the territory reclaimed from Britain more than two decades ago.",2020-05-28 13:50:57+00:00
North Koreans Accused of Laundering $2.5 Billion for Nuclear Program,"WASHINGTON — North Korean and Chinese citizens are operating a multibillion-dollar money laundering scheme to help fund the North’s nuclear weapons program, the Justice Department said in an indictment unsealed on Thursday. The case underscores the Trump administration’s inability to halt Pyongyang’s nuclear weapons program through diplomacy.",2020-05-28 15:39:41+00:00
Trump Speaks on China. Markets Rise,This briefing is no longer updating. Live updates can be found here. ,2020-05-29 09:00:54+00:00
Trump Speaks on China. Markets Rise,This briefing is no longer updating. Live updates can be found here. ,2020-05-29 09:00:54+00:00
"Rebuking China, Trump Curtails Ties to Hong Kong and Severs Them With W.H.O.","WASHINGTON — President Trump said Friday that his administration would “begin the process” of ending the American government’s special relationship with Hong Kong, including on trade and law enforcement, and that he was withdrawing from the World Health Organization, as part of a broad effort to retaliate against China.",2020-05-29 19:15:40+00:00
"Blaming China for Pandemic, Trump Says U.S. Will Leave the W.H.O.","After spending weeks accusing the World Health Organization of helping the Chinese government cover up the early days of the coronavirus epidemic in China, President Trump said on Friday that the United States would terminate its relationship with the agency.",2020-05-29 22:43:25+00:00
China and the Rhineland Moment,Great struggles between great powers tend to have a tipping point. It’s the moment when the irreconcilability of differences becomes obvious to nearly everyone.,2020-05-29 23:55:09+00:00
"As Virus Toll Preoccupies U.S., Rivals Test Limits of American Power","WASHINGTON — With the United States preoccupied by the sobering reality of more than 100,000 Americans dead from the coronavirus, China has pushed in recent weeks to move troops into disputed territory with India, continue aggressive actions in the South China Sea and rewrite the rules of how it will control Hong Kong.",2020-06-01 09:00:20+00:00
China Offers Measured Response to Trump’s Move on Hong Kong,"After staying quiet for days following President Trump’s move to curtail relations with Hong Kong, Beijing weighed in on Monday with a relatively measured response, suggesting that it might be waiting for details about Washington’s plan.",2020-06-01 11:47:36+00:00
‘We Need Help’: Coronavirus Fuels Racism Against Black Americans in China,"Jeff Remmington, an American professional basketball player trying his hand in China, had already been through xenophobic hell: ostracized in Guangzhou, where he was once celebrated for his acrobatic dunks, denied service at a restaurant with his 4-year-old son because of his skin color, quarantined for two weeks, though he showed no signs of coronavirus infection, he said.",2020-06-02 09:00:23+00:00
"As Protests Engulf the United States, China Revels in the Unrest","The cartoon shows the Statue of Liberty cracking into pieces, a police officer breaking through its copper robe. A man’s head lies on the ground in front of the White House, its facade splattered with blood.",2020-06-02 12:03:45+00:00
Philippines Backs Off Threat to Terminate Military Pact With U.S.,"MANILA — In a strategic setback for China, the Philippines government reversed itself Tuesday and said it would maintain a longstanding military pact with the United States that President Rodrigo Duterte has criticized as unfair.",2020-06-02 15:11:53+00:00
Why China May Call the World’s Bluff on Hong Kong,"HONG KONG — China long depended on Hong Kong to be everything it was not. The city’s freewheeling capitalism and personal freedoms, both absent from the mainland, made it one of the world’s premier financial hubs. Together, they flourished for decades.",2020-06-03 14:12:45+00:00
China Steps Back in Airline Dispute With the Trump Administration,"The Chinese authorities on Thursday appeared to retreat partially from an escalating dispute with the United States over air travel between the two countries, announcing that foreign airlines would be allowed to operate one flight per week in Chinese cities.",2020-06-03 14:49:26+00:00
"North Korea Lashes Out at U.S., Saying China Is Eclipsing It","SEOUL, South Korea — North Korea lashed out at both Seoul and Washington on Thursday, threatening to scrap key parts of agreements with South Korea and comparing the United States to a setting sun being eclipsed by China.",2020-06-04 05:32:04+00:00
"Chinese Hackers Target Email Accounts of Biden Campaign Staff, Google Says","WASHINGTON — Chinese hackers are targeting the personal email accounts of campaign staff members working for former Vice President Joseph R. Biden Jr., Google said on Thursday, while confirming previous reports that Iran has targeted President Trump’s campaign.",2020-06-04 22:30:29+00:00
U.S. Diplomats Struggle to Defend Democracy Abroad Amid Crises at Home,"WASHINGTON — American diplomats who are the global face of the United States are struggling with how to demand human rights, democracy and rule-of-law abroad amid concerns overseas and criticism at home over the Trump administration’s strong-arm response to the protests across the country.",2020-06-06 09:00:21+00:00
Senate Faults Oversight of Chinese Telecom Companies in U.S.,WASHINGTON — Senate investigators said Tuesday that government officials had “exercised minimal oversight” of the risks posed by three Chinese telecom companies that operate on American communications networks.,2020-06-09 09:00:13+00:00
A U.S. Secret Weapon in A.I.: Chinese Talent,"When the Defense Department launched Project Maven, an effort to remake American military technology through artificial intelligence, it leaned on a team of about a dozen engineers working at Google. Many of them, according to two people familiar with the arrangement, were Chinese citizens.",2020-06-09 14:00:10+00:00
E.U. Slams China Over Disinformation Campaign,This briefing has ended. Read live coronavirus updates here.,2020-06-10 09:36:06+00:00
China Shuts Vast Beijing Market as It Hunts Coronavirus Cluster,[Read our live Coronavirus cases and updates globally.],2020-06-12 09:16:54+00:00
"Faced With Crisis and Re-election, Senate Republicans Blame China","WASHINGTON — When Senator Martha McSally, one of the most politically endangered Republicans, was asked last month about reports that President Trump had brushed away warnings from his own aides about the looming threat of the coronavirus, she promptly pivoted.",2020-06-13 09:00:14+00:00
V.O.A. Directors Resign After Bannon Ally Takes Charge of U.S. Media Agency,"WASHINGTON — Two veteran journalists in charge of Voice of America, Amanda Bennett and Sandra Sugawara, resigned on Monday as a result of the recent congressional confirmation of a conservative activist and filmmaker to be the head of the agency that oversees the government broadcast organization.",2020-06-15 18:43:01+00:00
"India-China Border, Beijing Outbreak, Restaurants: Your Wednesday Briefing",(Want to get this briefing by email? Here’s the sign-up.),2020-06-16 19:36:32+00:00
Trump Trade Official Defends China Deal and Criticizes the W.T.O.,"WASHINGTON — The Trump administration’s top trade negotiator defended the president’s economic agreement with China on Wednesday, saying that Beijing was buying more American products and had reaffirmed its commitment to live up to the deal.",2020-06-17 22:14:45+00:00
George Floyd’s Brother Urges U.N. to Investigate Police Killings in U.S.,"GENEVA — The brother of George Floyd implored the United Nations on Wednesday to mount an investigation into racism, police brutality and police killings of unarmed black people in the United States.",2020-06-17 23:24:37+00:00
New Conservative Media Chief Dismisses Heads of U.S.-Funded News Outlets,"WASHINGTON — A conservative filmmaker who recently took over a United States global media agency removed the chiefs of four news organizations under its purview on Wednesday night, according to people with knowledge of the decision, in an action that raises questions about their editorial independence.",2020-06-18 03:29:35+00:00
China Lashes Out at U.S.’s Action Against Mass Incarcerations,[Read our 5 takeaways from John Bolton’s book.],2020-06-18 10:23:33+00:00
The Biggest Obstacle to China Policy: President Trump,,2020-06-18 23:27:13+00:00
"U.K. Contact Tracing, India-China Tensions, Stolen Van Gogh: Your Friday Briefing",(Want to get this briefing by email? Here’s the sign-up.),2020-06-19 04:03:32+00:00
Will India Side With the West Against China? A Test Is at Hand,"For years, the United States and its allies have tried to persuade India to become a closer military and economic partner in confronting China’s ambitions, painting it as a chance for the world’s largest democracy to counterbalance the largest autocracy.",2020-06-19 05:07:36+00:00
Law Will Tighten Beijing’s Grip on Hong Kong With Chinese Security Force,"China released a sweeping blueprint on Saturday to tighten its control over Hong Kong, revealing plans to establish a security agency in the territory to help Beijing extinguish challenges to its power after months of unrest.",2020-06-20 06:27:36+00:00
"Pushing for Serbia-Kosovo Peace Deal, U.S. Roils Allies","BERLIN — Last October, with the Balkans unsettled and the old tethers of American diplomacy coming apart, the Trump administration dispatched a new envoy to try to solve one of Europe’s longest-running territorial disputes: the two-decade standoff between Serbia and Kosovo.",2020-06-20 15:02:27+00:00
"China’s Man in Washington, Named Trump","“Nobody has been tougher on China than me,” President Trump has declared repeatedly, and he is trying to exploit anti-China feelings for his re-election. He portrays Joe Biden as soft on China, and his backers have run ads denouncing “Beijing Biden.”",2020-06-20 18:30:08+00:00
Trump Says He Avoided Punishing China Over Uighur Camps to Protect Trade Talks,"President Trump said he resisted punishing China for its mass internment of ethnic Uighurs last year for fear of jeopardizing trade talks with Beijing, a blunt admission of his transactional approach to human rights and willingness to subordinate other U.S. policy priorities to a potential trade deal he considers vital to his re-election.",2020-06-22 02:49:14+00:00
"E.U.-China Talks, Sweden, Working From Home: Your Tuesday Briefing",(Want to get this briefing by email? Here’s the sign-up.),2020-06-23 04:16:37+00:00
"Trapped Abroad, China’s ‘Little Pinks’ Rethink Their Country",James Liu has always considered himself a patriot.,2020-06-24 08:22:50+00:00
A Coronavirus Care Package From China,"CHICAGO — “The motherland is by your side” read the message printed on the plastic envelope. The characters were set in bright yellow against a crimson background, the same colors as on China’s national flag. “Genuine affection from 10,000 miles away.”",2020-06-25 09:01:14+00:00
"China’s Military Provokes Its Neighbors, but the Message Is for the United States","In the same week that Chinese and Indian soldiers engaged in a deadly brawl, one of China’s submarines cruised through the waters near Japan, prompting a scramble of aircraft and ships to track its furtive movements. Chinese fighter jets and at least one bomber buzzed Taiwan’s territorial airspace almost daily.",2020-06-26 07:00:12+00:00
E.U. Plans to Bar Most U.S. Travelers When Bloc Reopens,"BRUSSELS — The European Union is ready to bar most travelers from the United States, Russia, and dozens of other countries considered too risky because they have not controlled the coronavirus outbreak, E.U. officials said Friday.",2020-06-26 21:08:28+00:00
"India Bans Nearly 60 Chinese Apps, Including TikTok and WeChat","India’s government banned nearly 60 Chinese mobile apps on Monday, including TikTok, citing national security concerns, after a deadly clash between their militaries this month raised tensions between the two countries to the highest level in decades.",2020-06-29 17:15:34+00:00
U.S. Halts High-Tech Exports to Hong Kong Over Security Concerns,"WASHINGTON — The Trump administration placed new restrictions on U.S. exports of defense equipment and certain high-technology products to Hong Kong on Monday, in response to a new Chinese law aimed at tightening Beijing’s control over the territory.",2020-06-29 22:25:19+00:00
